ASP;Denominazione;Indirizzo;Citta';Provincia;Attivita';Tipo sede
ME;2010 GROUP DIAGNOSTICA CLINICA ASSOCIATA SC A RL;via Concezione  12;Messina;ME;Medicina di laboratorio - Aggregazione;Punto di accesso
ME;2010 GROUP DIAGNOSTICA CLINICA ASSOCIATA SC A RL;via Maddalena  24 Is. 157;Messina;ME;Medicina di laboratorio - Aggregazione;Punto di accesso
ME;2010 GROUP DIAGNOSTICA CLINICA ASSOCIATA SC A RL;via Natoli  20;Messina;ME;Medicina di laboratorio - Aggregazione;Punto di accesso
ME;2010 GROUP DIAGNOSTICA CLINICA ASSOCIATA SC A RL;VIA NATOLI N. 20;Messina;ME;Medicina di laboratorio - Aggregazione;Sede Operativa
ME;AESCULAPIUS SRL;CORSO MATTEOTTI  2;Patti;ME;Medicina di laboratorio;Sede Operativa
ME;AGGREGAZIONE MEDICINA DI LABORATORIO - AML SC A RL;VIA CANOVA NÂ° 149;Messina;ME;Medicina di laboratorio - Aggregazione;Punto di accesso
ME;AIAS ONLUS - SEZIONE DI BARCELLONA POZZO DI GOTTO ;VIA GRAMSCI, COMPLESSO IL QUADRIFOGLIO;Milazzo;ME;Presidi di riabilitazione funzionale di portatori disabilità  fisiche psichiche e sensoriali;Sede Operativa
ME;AIAS ONLUS - SEZIONE DI SAN FILIPPO DEL MELA ;CONTRADA DONNAMIATA;San Filippo del Mela;ME;Presidi di riabilitazione funzionale di portatori disabilità  fisiche psichiche e sensoriali;Sede Operativa
ME;AIAS ONLUS - SEZIONE DI SAN FILIPPO DEL MELA - CENTRO AMBULATORIALE TREMESTIERI ;VIA ROTONDA  5 - TREMESTIERI ;Messina;ME;Presidi di riabilitazione funzionale di portatori disabilità  fisiche psichiche e sensoriali;Sede Operativa
ME;AIAS ONLUS - SEZIONE TAORMINA ;VIA FRANCAVILLA 135;Taormina;ME;Presidi di riabilitazione funzionale di portatori disabilità  fisiche psichiche e sensoriali;Sede Operativa
ME;"AIAS ONLUS MESSINA - CENTRO AMBULATORIALE DI RIABILITAZIONE ""FRANCESCO FASCIA"" ";VIA ISTRIA, ISOL. 416/A;Messina;ME;Presidi di riabilitazione funzionale di portatori disabilità  fisiche psichiche e sensoriali;Sede Operativa
ME;ALFA SNC DI LANZA VOLPE CARMELO E C;PIAZZA DUOMO  24;Sant'Agata di Militello;ME;Medicina di laboratorio;Sede Operativa
ME;ALFANO SAS DI ALFANO SALVINA & C;VIA PAPA GIOVANNI XXIII  139;Barcellona Pozzo di Gotto;ME;Medicina di laboratorio;Sede Operativa
ME;AMBULATORIO DI RADIOLOGIA DOTT. CURRO' DOMENICO SRL;Via Kennedy 157;Barcellona Pozzo di Gotto;ME;Radiologia;Sede Operativa
ME;AMBULATORIO DI REUMATOLOGIA DOTT SARHAN AYED;vicolo Archimede Prima Traversa n. 30;Sant'Agata di Militello;ME;Reumatologia;Sede Operativa
ME;AMBULATORIO ODONTOIATRICO CRUPI DI CECILIA CRUPI SAS;VIA F. CRISPI 4;Messina;ME;Odontoiatria;Sede Operativa
ME;AMBULATORIO ODONTOIATRICO DOTT  TRUSSO SFRAZZETTO STEFANIA;VIA L. PICCOLO 29;Capo d'Orlando;ME;Odontoiatria;Sede Operativa
ME;AMBULATORIO ODONTOIATRICO DOTT CARMELO GIOVANNI BUEMI;VIA DEL MARE 25;Barcellona Pozzo di Gotto;ME;Odontoiatria;Sede Operativa
ME;AMBULATORIO ODONTOIATRICO DOTT GIOVANNA LO PRESTI;VIA CAP. F. ZUCCARELLO 113;Patti;ME;Odontoiatria;Sede Operativa
ME;AMBULATORIO ODONTOIATRICO DOTT LA MALFA ROSARIA ANNA;VIA RISORGIMENTO 113;Milazzo;ME;Odontoiatria;Sede Operativa
ME;AMBULATORIO ODONTOIATRICO DOTT LA SPADA;VIA CARLO ALBERTO DALLA CHIESA 68/70;Librizzi;ME;Odontoiatria;Sede Operativa
ME;AMBULATORIO ODONTOIATRICO DOTT RUSSO EDUARDO;VIA LORENZO CUTUGNO 42;Barcellona Pozzo di Gotto;ME;Odontoiatria;Sede Operativa
ME;AMBULATORIO ODONTOIATRICO PRONESTI' SAS DI PRONESTI' CLAUDIO E PRONESTI' ROBERTO;VIA MAIO MARIANO 81;Milazzo;ME;Odontoiatria;Sede Operativa
ME;AMBULATORIO ODONTOIATRICO PRONESTI' SAS DI PRONESTI' CLAUDIO E PRONESTI' ROBERTO;VIA GIORDANO BRUNO 137 IS. 80;Messina;ME;Odontoiatria;Sede Operativa
ME;AMBULATORIO POLISPECIALISTICO SS ANNUNZIATA SRL;PIAZZA MATTEOTTI  11;Messina;ME;Poliambulatorio;Sede Operativa
ME;ANALISI BIOMEDICHE LENZO ABL SAS DI LENZO GIUSEPPE & C;VIA FRANCESCO CRISPI  219/D;Santa Teresa di Riva;ME;Medicina di laboratorio;Sede Operativa
ME;ANALISI CHIMICHE CLINICHE  MICROBIOLOGICHE TERME DEL DOTT  D IMBESI & C SAS;VIALE DELLE TERME  85;Terme Vigliatore;ME;Medicina di laboratorio;Sede Operativa
ME;ANALISI CHIMICO CLINICHE DOTTSSA C LA FERLITA ;VIA G. LA FARINA IS. 278 SCALA E;Messina;ME;Medicina di laboratorio;Sede Operativa
ME;ANALISI CLINICHE CALISPERA DOTT CURRO' GIACOMO SRL;SS 114 KM 4,020 CONTESSE;Messina;ME;Medicina di laboratorio;Sede Operativa
ME;ANALISI CLINICHE DELTA SAS DI MIRAGLIA PIETRO LORENZO ANTONINO & C;via San Martino 20;Brolo;ME;Medicina di laboratorio;Sede Operativa
ME;ANALISI CLINICHE DI AGOSTA GIUSEPPE E DI MUNI MARCELLA & C SNC;VIA MERCATO  1/3;Cesarò;ME;Medicina di laboratorio;Sede Operativa
ME;ANALISI QUATTROCCHI M & MIRICI SNC;VIA STRADALE S. NAGRA 1/A;Tortorici;ME;Medicina di laboratorio;Sede Operativa
ME;ANALISI SNC;VIA TRIESTE 52;Patti;ME;Medicina di laboratorio;Sede Operativa
ME;ANALYSIS SRL;VIA MADONNA DEL LUME 25;Milazzo;ME;Medicina di laboratorio;Sede Operativa
ME;ANFFAS ONLUS DI MESSINA;VIALE PRINCIPE UMBERTO 93;Messina;ME;Presidi di riabilitazione funzionale di portatori disabilità  fisiche psichiche e sensoriali;Sede Operativa
ME;AQUASALUS SRL;VIA DEL VESPRO SNC;Venetico;ME;Residenza Sanitaria Assistita;Sede Operativa
ME;ASSOCIAZIONE ANTEA ONLUS;VIA ETTORE LOMBARDO PELLEGRINO 23/C;Messina;ME;Assistenza domiciliare persone in fase terminale;Sede Operativa
ME;ASSOCIAZIONE LELAT (LEGA LOTTA AIDS E TOSSICODIPENDENZE);VIA GAETANO ALESSI 74 (RIONE MANGIALUPI);Messina;ME;Strutture riabilitazione ed educative assistenziali per dipendenti sostanze d'abuso;Sede Operativa
ME;ASSOCIAZIONE TRE ALI ONLUS;VIA LA FARINA 7;Messina;ME;Presidi di riabilitazione funzionale di portatori disabilità  fisiche psichiche e sensoriali;Sede Operativa
ME;AUTISMO ASSOCIAZIONE TEMPORANEA TRA ONLUS;VIA OLIVARELLA SNC;Nizza di Sicilia;ME;Centro diurno per soggetti affetti da disturbo autistico;Sede Operativa
ME;AZIENDA SANITARIA POLIDIAGNOSTICA KENNEDY SRL;VIA KENNEDY  43/45;Brolo;ME;Medicina di laboratorio;Sede Operativa
ME;BENEROM SWEDISH CLUB DI SACCA' MARIO E C SAS;VIA MEDICI  26;Sant'Agata di Militello;ME;Presidio ambulatoriali recupero riabilitazione;Sede Operativa
ME;CAPP 1990 COOPERATIVA SOCIALE;Via Oliveto s.n.c;Gaggi;ME;Presidi di riabilitazione funzionale di portatori disabilità  fisiche psichiche e sensoriali;Sede Operativa
ME;CAPP 1990 COOPERATIVA SOCIALE;Via Giovanni Grasso 2/A ;Sant'Agata di Militello;ME;Presidi di riabilitazione funzionale di portatori disabilità  fisiche psichiche e sensoriali;Sede Operativa
ME;CAPP 1990 COOPERATIVA SOCIALE;VIA KENNEDY 21/B ;Patti;ME;Presidi di riabilitazione funzionale di portatori disabilità  fisiche psichiche e sensoriali;Sede Operativa
ME;CARDIO CENTER SRL;VIA GHIBELLINA 135;Messina;ME;Cardiologia;Sede Operativa
ME;CARDIO STUDIO SAS DI G ED S CUTUGNO & C;VIALE EUROPA  83/M IS. 47/B;Messina;ME;Cardiologia;Sede Operativa
ME;CARDIONOVA SAS DI MAJOLINO MARIO E STELLA BRIENZA LUIGI E C SAS;VIA TORRENTE TRAPANI CASE PARISI PAL B;Messina;ME;Cardiologia;Sede Operativa
ME;CASA DI CURA CAPPELLANI GIOMI ;VIALE REGINA ELENA 335 ;Messina;ME;Casa di cura;Sede Operativa
ME;CASA DI CURA CARMONA ;V.LE P.PE UMBERTO 75/G;Messina;ME;Casa di cura;Sede Operativa
ME;CASA DI CURA COT CURE ORTOPEDICHE TRAUMATOLOGICHE;VIA TORRENTE CAPPUCCINI;Lipari;ME;Attività  ambulatoriale case di cura private;Sede Operativa Secondaria
ME;CASA DI CURA COT CURE ORTOPEDICHE TRAUMATOLOGICHE;VIA DUCEZIO 1;Messina;ME;Attività  ambulatoriale case di cura private;Sede Operativa
ME;CASA DI CURA COT CURE ORTOPEDICHE TRAUMATOLOGICHE ;VIA DUCEZIO 1;Messina;ME;Casa di cura;Sede Operativa
ME;CASA DI CURA CRISTO RE ;VIALE P.PE UMBERTO 89;Messina;ME;Attività  ambulatoriale case di cura private;Sede Operativa
ME;CASA DI CURA CRISTO RE SRL;VIALE P. UMBERTO 89;Messina;ME;Casa di cura;Sede Operativa
ME;CASA DI CURA GIOMI SPA ISTITUTO ORTOPEDICO DEL MEZZOGIORNO D'ITALIA F  SCALABRINO;VIA CONSOLARE POMPEA 360;Messina;ME;Attività  ambulatoriale case di cura private;Sede Operativa
ME;CASA DI CURA GIOMI SPA ISTITUTO ORTOPEDICO DEL MEZZOGIORNO D'ITALIA F  SCALABRINO;VIA CONSOLARE POMPEA 360;Messina;ME;Casa di cura;Sede Operativa
ME;CASA DI CURA S CAMILLO;VIALE PRINCIPE UMBERTO 71;Messina;ME;Attività  ambulatoriale case di cura private;Sede Operativa
ME;CASA DI CURA S CAMILLO;VIALE PRINCIPE UMBERTO 71;Messina;ME;Casa di cura;Sede Operativa
ME;CASA DI CURA VILLA IGEA ;VIA CONSOLARE VALERIA 45/47 ;Messina;ME;Casa di cura;Sede Operativa
ME;CASA DI CURA VILLA IGEA SRL;VIA CONSOLARE VALERIA 45/47 ;Messina;ME;Attività  ambulatoriale case di cura private;Sede Operativa
ME;CASA DI CURA VILLA SALUS;VIALE REGINA MARGHERITA 15/B;Messina;ME;Attività  ambulatoriale case di cura private;Sede Operativa
ME;CASA DI CURA VILLA SALUS ;VIALE REGINA MARGHERITA 15/B;Messina;ME;Casa di cura;Sede Operativa
ME;CDF CENTRO DIAGNOSTICO FIORELLO SAS ANALISI CLINICHE DI FIORELLO SANTINA;VIA MANCINI  18;Capo d'Orlando;ME;Medicina di laboratorio;Sede Operativa
ME;CENTRO CRISAFULLI  ORTOPEDIA, MEDICINA FISICA E RIABILITATIVA  SAS DELLA DOTTSSA DANIELA CRISAFULLI & C;VIALE CADORNA IS. 212;Messina;ME;Presidio ambulatoriali recupero riabilitazione;Sede Operativa
ME;CENTRO DI FISIOKINESITERAPIA QUATTROCCHI AGOSTINO DI SACCA' MARIO E BONFIGLIO CHILLEMI FELICIA SAS ;VIA KENNEDY  ANG. VIA GARIBALDI;Barcellona Pozzo di Gotto;ME;Presidio ambulatoriali recupero riabilitazione;Sede Operativa
ME;CENTRO DI MEDICINA RIABILITATIVA AMMANNATO SRL;S.S. 114  102 CONTESSE;Messina;ME;Presidio ambulatoriali recupero riabilitazione;Sede Operativa
ME;CENTRO DI MEDICINA RIABILITATIVA DOTTSSA ANNAMARIA MARCHESE SAS;VAI CAMPO SPORTIVO  21;Santa Teresa di Riva;ME;Presidio ambulatoriali recupero riabilitazione;Sede Operativa
ME;CENTRO DI SOLIDARIETA' FARO SOCIETA' COOPERATIVA SOCIALE;VIA SAN JACHIDDU 74;Messina;ME;Strutture riabilitazione ed educative assistenziali per dipendenti sostanze d'abuso;Sede Operativa
ME;CENTRO DIAGNOSTICA PER IMMAGINI SRL;VIA CAMPO SPORTIVO  21;Santa Teresa di Riva;ME;Radiologia;Sede Operativa
ME;CENTRO DIAGNOSTICO BOCCETTA SRL;VIA FAUSTINA E TERTULLO IS. 356;Messina;ME;Medicina di laboratorio;Sede Operativa
ME;CENTRO DIAGNOSTICO CARDIOVASCOLARE DI GRECO ANNA MARIA E C SAS;VIA PRIVATA P. BORSELLINO 37;Milazzo;ME;Cardiologia;Sede Operativa
ME;CENTRO DIAGNOSTICO CRISTINA SC A RL;VIA PIETRO NENNI 9-11;Santa Lucia del Mela;ME;Medicina di laboratorio - Aggregazione;Punto di accesso
ME;CENTRO DIAGNOSTICO CRISTINA SC A RL;via Giardino 1;Montalbano Elicona;ME;Medicina di laboratorio - Aggregazione;Punto Prelievo
ME;CENTRO DIAGNOSTICO CRISTINA SC A RL;via Romagnosi 18;Messina;ME;Medicina di laboratorio - Aggregazione;Punto di accesso
ME;CENTRO DIAGNOSTICO CRISTINA SC A RL;corso Cavour 74;Messina;ME;Medicina di laboratorio - Aggregazione;Punto di accesso
ME;CENTRO DIAGNOSTICO CRISTINA SC A RL;via Citarella is. 78;Messina;ME;Medicina di laboratorio - Aggregazione;Punto di accesso
ME;CENTRO DIAGNOSTICO CRISTINA SC A RL;via Consolare Pompea 1383;Messina;ME;Medicina di laboratorio - Aggregazione;Punto di accesso
ME;CENTRO DIAGNOSTICO CRISTINA SC A RL;via S. Anna 68;Falcone;ME;Medicina di laboratorio - Aggregazione;Punto di accesso
ME;CENTRO DIAGNOSTICO CRISTINA SC A RL ;VIA KENNEDY N. 500;Barcellona Pozzo di Gotto;ME;Medicina di laboratorio - Aggregazione;Sede Operativa
ME;CENTRO DIAGNOSTICO MESSINA SUD SRL;SS 114 KM 5,400 TREMESTIERI;Messina;ME;Radiologia;Sede Operativa
ME;CENTRO DIURNO LAM 85;CONTRADA ZUCCHERA 2 - VILL. SANT'AGATA;Messina;ME;Strutture riabilitazione ed educative assistenziali per dipendenti sostanze d'abuso;Sede Operativa
ME;CENTRO NAVACITA (ASS SORGE IL SOLE ONLUS);C.DA CRESTA;Naso;ME;Centro diurno per soggetti affetti da disturbo autistico;Sede Operativa
ME;CENTRO NUCLEARE SAS DI GENOVESE ADELE & C;VIA TRIESTE 48;Barcellona Pozzo di Gotto;ME;Radiologia;Sede Operativa
ME;CENTRO OFTALMICO REGIS SAS DI MEZZANO OSCAR E C;via M. Regis 65 ;Milazzo;ME;Oculistica;Sede Operativa
ME;CENTRO SERVIZI MEDICI SC A RL;via Silipigni 7;Taormina;ME;Medicina di laboratorio - Aggregazione;Punto di accesso
ME;CENTRO SERVIZI MEDICI SC A RL;VIA VITTORIO EMANUELE 75;Giardini-Naxos;ME;Medicina di laboratorio - Aggregazione;Punto di accesso
ME;CENTRO SERVIZI MEDICI SC A RL;via Rosario 45;Francavilla di Sicilia;ME;Medicina di laboratorio - Aggregazione;Punto di accesso
ME;CENTRO SERVIZI MEDICI SC A RL;via S. Ermanno 1;Messina;ME;Medicina di laboratorio - Aggregazione;Punto di accesso
ME;CENTRO SERVIZI MEDICI SC A RL;via Canova 149 isol. 5;Messina;ME;Medicina di laboratorio - Aggregazione;Punto di accesso
ME;CENTRO SICILIANO DI NEFROLOGIA E DIALISI;C.DA FAVATA';Santo Stefano di Camastra;ME;Dialisi;Sede Operativa
ME;CENTRO TERAPIA DI GREGORIO & C SAS;VIA TOMMASO CANNIZZARO  219;Messina;ME;Presidio ambulatoriali recupero riabilitazione;Sede Operativa
ME;COD SRL;VIA CONSOLARE VALERIA 64;Acquedolci;ME;Odontoiatria;Sede Operativa
ME;CONSORZIO D'AMICO 1980;via della Concordia 45;Milazzo;ME;Medicina di laboratorio - Aggregazione;Punto di accesso
ME;CONSORZIO D'AMICO 1980;via Nazionale 88;Villafranca Tirrena;ME;Medicina di laboratorio - Aggregazione;Punto di accesso
ME;CONSORZIO D'AMICO 1980;via Nazionale  50/P;Torregrotta;ME;Medicina di laboratorio - Aggregazione;Punto di accesso
ME;"CONSORZIO D'AMICO 1980     
";VIA NAZIONALE N. 50/P - FRAZIONE SCALA - ;Torregrotta;ME;Medicina di laboratorio - Aggregazione;Sede Operativa
ME;CONSULTORIO AIED ASSOCIAZIONE ITALIANA EDUCAZIONE DEMOGRAFICA;VIA GIUSEPPE CAPORALE 83/85 LOC.  S. AGATA;Messina;ME;Consultorio;Sede Operativa
ME;CONSULTORIO FAMILIARE UCIPEM ONLUS;VIA CALAMARO, 13;Villafranca Tirrena;ME;Consultorio;Sede Operativa
ME;CRU - CENTRO DI RIPRODUZIONE UMANA SRL;VIA TRENTO 20;Messina;ME;Procreazione Medicalmente Assistita;Sede Operativa
ME;CTA KENNEDY SRL;VIA FERDINANDO STAGNO D'ALCONTRES CDA PAPARDO;Messina;ME;Comunità  Terapeutica Assistita;Sede Operativa
ME;CTA KENNEDY SRL;VIA KENNEDY 1;Saponara;ME;Comunità  Terapeutica Assistita;Sede Operativa
ME;DIAGNOSTICA ARCHIMEDE SRL;VIA ARCHIMEDE 8;Sant'Agata di Militello;ME;Medicina di laboratorio;Sede Operativa
ME;DIAGNOSTICA DEI VERDI SRL;VIA DEI VERDI 58;Messina;ME;Medicina di laboratorio;Sede Operativa
ME;DIAVERUM ITALIA SRL;VIA  GENERALE ANGELO CAMBRIA 2;Barcellona Pozzo di Gotto;ME;Dialisi;Sede Operativa
ME;DISMED CENTRO STUDI PER LE DISABILITA' DEL MEDITERRANEO - ASSOCIAZIONE ONLUS;VIA TRIESTE 3 C.DA CUSOLITO - FARO SUPERIORE;Messina;ME;Presidi di riabilitazione funzionale di portatori disabilità  fisiche psichiche e sensoriali;Sede Operativa
ME;DOTT ALFIO SAPIA;S.S. 114 KM. 3,500 TOP RESIDENCE;Messina;ME;Dermatologia;Sede Operativa
ME;DOTT PIETRO MAZZAGATTI;VIA XXI OTTOBRE 606;Torregrotta;ME;Odontoiatria;Sede Operativa
ME;DOTT SILVESTRO MARTELLA;VIA CONSOLARE POMPEA  1741;Messina;ME;Medicina di laboratorio;Sede Operativa
ME;DOTT STELLA BRIENZA LUCIA SAS;VIA NAZIONALE 182/B VILLAGGIO S. MARGHERITA;Messina;ME;Medicina di laboratorio;Sede Operativa
ME;DOTT TRIFIRO' ANTONIO FRANCO ODONTOIATRIA E PROTESI DENTARIA;VIA GIOVANNI VERGA 26;Sant'Agata di Militello;ME;Odontoiatria;Sede Operativa
ME;DOTT.MASSIMO NATALE SRL;VIA CONSOLARE ANTICA 562/C;Capo d'Orlando;ME;Odontoiatria;Sede Operativa
ME;DOTTSSA ROSANNA VIOLA;VIALE DELLA LIBERTA'   115;Messina;ME;Odontoiatria;Sede Operativa
ME;ECAS  SAS DEL DOTT POLITO DOMENICO E FIGLI;VIA DEI MILLE  20;Milazzo;ME;Cardiologia;Sede Operativa
ME;EMMI LAB DIAGNOSTICA SC A RL;Piazzale Mercato Complesso I Portici;Santa Teresa di Riva;ME;Medicina di laboratorio - Aggregazione;Punto di accesso
ME;EMMI LAB DIAGNOSTICA SC A RL;via Damiano Rosso 2;Taormina;ME;Medicina di laboratorio - Aggregazione;Punto di accesso
ME;EMMI LAB DIAGNOSTICA SC A RL ;VIA DAMIANO ROSSO N. 2;Taormina;ME;Medicina di laboratorio - Aggregazione;Sede Operativa
ME;EMODIAGNOSTICA SAS DI FRANCHINA GIUSEPPE E C;VIA ROMA  15;Tortorici;ME;Medicina di laboratorio;Sede Operativa
ME;EMOLAB DOTT ANGELO SINDONI & C SAS;VIA NAZIONALE  206;Villafranca Tirrena;ME;Medicina di laboratorio;Sede Operativa
ME;EUROGESTIONI SPA - IL GIARDINO SUI LAGHI ;VIA CONSOLARE POMPEA 1935;Messina;ME;Residenza Sanitaria Assistita;Sede Operativa
ME;EVA SRL;VIALE ITALIA  1;Messina;ME;Medicina di laboratorio;Sede Operativa
ME;EVA SRL;VIALE ITALIA  1;Messina;ME;Radiologia Diagnostica;Sede Operativa
ME;FISIOKINESITERAPIA MALFA SRL;VIA UGO SANT'ONOFRIO N. 89;Barcellona Pozzo di Gotto;ME;Presidio ambulatoriali recupero riabilitazione;Sede Operativa
ME;FKT SAS DI BUEMI & C;PIAZZA NASTASI 3/4;Milazzo;ME;Presidio ambulatoriali recupero riabilitazione;Sede Operativa
ME;GENOVESE HUB;VIA STAZIONE N 5;Falcone;ME;Medicina di laboratorio - Aggregazione;Punto di accesso
ME;GENOVESE HUB;VIA ROMA 79;Barcellona Pozzo di Gotto;ME;Medicina di laboratorio - Aggregazione;Punto di accesso
ME;GENOVESE HUB;VIA ROMA 79;Barcellona Pozzo di Gotto;ME;Medicina di laboratorio - Aggregazione;Sede Operativa
ME;HOTEL TERME ACQUA GRAZIA;VIA F. CRISPI 187;Alì Terme;ME;Terme;Sede Operativa
ME;IL CUORE - DIAGNOSTICA E PREVENZIONE CARDIOVASCOLARE DELLA DSSA CARMELINA SIGNORINO & C SAS;VIA CONSOLARE VALERIA 118 E;Giardini-Naxos;ME;Cardiologia;Sede Operativa
ME;IPPOCRATE SRL PADRE PIO;VIA CESARE BATTISTI CONTRADA LITANIA;Furci Siculo;ME;Dialisi;Sede Operativa
ME;LA DIAGNOSTICA DI LURASCHI MARIANNA NUNZIATA & C SAS;VIA ROMA  325;Scaletta Zanclea;ME;Medicina di laboratorio;Sede Operativa
ME;LA DIAGNOSTICA SC A RL;viale San Martino 401 is. 12;Messina;ME;Medicina di laboratorio - Aggregazione;Punto di accesso
ME;LA DIAGNOSTICA SC A RL;via 37/A Fondofucile;Messina;ME;Medicina di laboratorio - Aggregazione;Punto di accesso
ME;LA DIAGNOSTICA SC A RL;via Ghibellina 45 is. 282;Messina;ME;Medicina di laboratorio - Aggregazione;Punto di accesso
ME;LA DIAGNOSTICA SC A RL;via Ugo Bassi 128;Messina;ME;Medicina di laboratorio - Aggregazione;Punto di accesso
ME;LA DIAGNOSTICA SC A RL;viale Italia 1;Messina;ME;Medicina di laboratorio - Aggregazione;Punto di accesso
ME;LA DIAGNOSTICA SC A RL;via Vittorio Veneto 13;Milazzo;ME;Medicina di laboratorio - Aggregazione;Punto di accesso
ME;"LA DIAGNOSTICA SC A RL  
";VIA VITTORIO VENETO N. 15 - ;Milazzo;ME;Medicina di laboratorio - Aggregazione;Sede Operativa
ME;LA FAMIGLIA;VIA S. PALADINO 12;Giardini-Naxos;ME;Consultorio;Sede Operativa
ME;LA MADONNINA SRL;VIA CONSOLARE STRADELLA;Capo d'Orlando;ME;Poliambulatorio;Sede Operativa
ME;LA RINASCENTE SAS DI ANTONINO TRIFIRO' E LUCIANA IMPALLOMENI & C SAS;VIA DEI MILLE IS.  101  n. 243;Messina;ME;Presidio ambulatoriali recupero riabilitazione;Sede Operativa
ME;LA SPADA CENTRO MEDICO DENTISTICO SRL;VIA CADUTI SUL LAVORO 25;Barcellona Pozzo di Gotto;ME;Odontoiatria;Sede Operativa
ME;LAB ANALISI CLINICHE  DOTT CARMELO SAITTA SRL;VIA UMBERTO I  380;Roccalumera;ME;Medicina di laboratorio;Sede Operativa
ME;LAB QUALITY CONTROL SRL;VIA GIOVANNI DEL MAESTRO 8;Messina;ME;Medicina di laboratorio;Sede Operativa
ME;LABORATORIO ANALISI CLINICHE CATALIOTO MARIA;VIA PIRANDELLO 13;Sant'Agata di Militello;ME;Medicina di laboratorio;Sede Operativa
ME;LABORATORIO ANALISI CLINICHE CEIBA DI MASCALI ANTONIO E RUSSO SEBASTIANO SNC;VIA TEVERE;Giardini-Naxos;ME;Medicina di laboratorio;Sede Operativa
ME;LABORATORIO ANALISI CLINICHE DEI DOTTORI ARAGONA GIUSEPPE E ARAGONA PIETRO SNC;VIA B. CROCE  24;Barcellona Pozzo di Gotto;ME;Medicina di laboratorio;Sede Operativa
ME;LABORATORIO ANALISI CLINICHE DEL DOTT TOMASI ANTONINO E C SAS;VIA NAZIONALE  282/284;Capri Leone;ME;Medicina di laboratorio;Sede Operativa
ME;LABORATORIO ANALISI CLINICHE LOMBARDO ANNA;VIA VITT. EMANUELE 55/57;Giardini-Naxos;ME;Medicina di laboratorio;Sede Operativa
ME;LABORATORIO ANALISI CLINICHE NAXOS;VIA MAZZINI  15;Naso;ME;Medicina di laboratorio;Sede Operativa
ME;LABORATORIO ANALISI DI DI BERNARDO S & C SAS;VIA UMBERTO I  21/23;Barcellona Pozzo di Gotto;ME;Medicina di laboratorio;Sede Operativa
ME;LABORATORIO ANALISI DOTT STEFANO LA SPADA E DOTT MARCELLO GALI' SNC ;VIA COLLODI 1;Spadafora;ME;Medicina di laboratorio;Sede Operativa
ME;LABORATORIO ANALISI DOTTSSA TRIFILO' GISELLA;VIA CATANIA  20;Sant'Agata di Militello;ME;Medicina di laboratorio;Sede Operativa
ME;LABORATORIO ANALISI S ALESSIO;VIA CONSOLARE VALERIA 14;Sant'Alessio Siculo;ME;Medicina di laboratorio;Sede Operativa
ME;LABORATORIO DI ANALISI CLINICHE BOMBARA DI MORABITO DOMENICA & C SAS;VIA SAN MARTINO 246;Messina;ME;Medicina di laboratorio;Sede Operativa
ME;LABORATORIO DI ANALISI CLINICHE DEL DOTT BONGIORNO GIUSEPPE E FIGLIA SNC;VIA SERPI  53;San Fratello;ME;Medicina di laboratorio;Sede Operativa
ME;LABORATORIO DI ANALISI CLINICHE SAN NICOLO';VIA UMBERTO I 211/A;Gioiosa Marea;ME;Medicina di laboratorio;Sede Operativa
ME;LABORATORIO DI ANALISI DI STEFANO SRL;VIA RISORGIMENTO 93;Messina;ME;Medicina di laboratorio;Sede Operativa
ME;"LABORATORIO DI ANALISI LA ROSA SAS DELLA DOTTSSA
LAVINIA GIORDANO & C";VIA CESAR BATTISTI IS. 131 NÂ° 265;Messina;ME;Medicina di laboratorio;Sede Operativa
ME;LABORATORIO DIAGNOSTICO BERTUCCI DI P  GROSSO E G BUDA SNC;VIA CENTONZE  101;Messina;ME;Medicina di laboratorio;Sede Operativa
ME;LABORATORIO DIAGNOSTICO DOTTRI SEBASTIANO E CLAUDIO CANFORA SRL;VIALE SAN MARTINO IS. 56 315;Messina;ME;Medicina di laboratorio;Sede Operativa
ME;LABORATORIO S RITA SNC DI TRIFILO' ENNIO MARIA E FIGLI;VIA LUIGI PIRANDELLO  49;Capo d'Orlando;ME;Medicina di laboratorio;Sede Operativa
ME;LABORATORIO SCIENTIFICO DOTT  ROSETTA PANZERA DI GAETANO CAUDULLO  E  C SNC;VIA CATANIA IS. 1/2;Messina;ME;Medicina di laboratorio;Sede Operativa
ME;LABOS SRL AMBULATORIO NEFROLOGIA ED EMODIALISI;VIA LIBERTA' 127;Pace del Mela;ME;Dialisi;Sede Operativa
ME;MEDICAL CENTER SRL;VIA MARINA 163 PIANO PRIMO;Nizza di Sicilia;ME;Presidio ambulatoriali recupero riabilitazione;Sede Operativa
ME;MEDICAL CENTER SRL;VIA MARINA 163;Nizza di Sicilia;ME;Presidi di riabilitazione funzionale di portatori disabilità  fisiche psichiche e sensoriali;Sede Operativa
ME;MEDICAL SYSTEM DELLA DOTTSSA GIOVANNA SCHEPIS & C SAS;VIA GARIBALDI 9 FRAZ. GIAMMORO;Pace del Mela;ME;Medicina di laboratorio;Sede Operativa
ME;NEPHROCARE SPA;SS 114 KM 10 GALATI MARINA;Messina;ME;Dialisi;Sede Operativa
ME;NEPHROCARE SPA;VIA MARCO POLO  499;Messina;ME;Dialisi;Sede Operativa
ME;NOVAMEDICA SNC DEL DOTT ROSARIO COSTA E C;VIA DEI MILLE IS. 88 n. 265;Messina;ME;Presidio ambulatoriali recupero riabilitazione;Sede Operativa
ME;ODONTO CENTER SAS;PIAZZA NASTASI 31/32;Milazzo;ME;Odontoiatria;Sede Operativa
ME;ODONTOMAX  SAS DI DOMENICO BUDA & C;VIA MONS. PAINO 14;Barcellona Pozzo di Gotto;ME;Odontoiatria;Sede Operativa
ME;OMEGA CENTRO DIALISI SRL;VIA CONCA D'ORO PAL. 1/S S.S. ANNUNZIATA;Messina;ME;Dialisi;Sede Operativa
ME;OPUS RESIDENTIAL SRL ;VIA XXIV  MAGGIO 155;Messina;ME;Residenza Sanitaria Assistita;Sede Operativa
ME;PASTEUR CENTRI DIAGNOSTICI CONSORZIATI;VIA VITTORIO VENETO 18;Sinagra;ME;Medicina di laboratorio - Aggregazione;Punto Prelievo
ME;PASTEUR CENTRI DIAGNOSTICI CONSORZIATI;VIA SUBIESCHI 2;Mistretta;ME;Medicina di laboratorio - Aggregazione;Punto di accesso
ME;PASTEUR CENTRI DIAGNOSTICI CONSORZIATI;VIA XXIV MAGGIO 21;Lipari;ME;Medicina di laboratorio - Aggregazione;Punto di accesso
ME;PASTEUR CENTRI DIAGNOSTICI CONSORZIATI;S.S. 114 KM 5,400 PISTUNINA;Messina;ME;Medicina di laboratorio - Aggregazione;Punto di accesso
ME;PASTEUR CENTRI DIAGNOSTICI CONSORZIATI;VIALE REGINA MARGHERITA 34/D;Messina;ME;Medicina di laboratorio - Aggregazione;Punto di accesso
ME;PASTEUR CENTRI DIAGNOSTICI CONSORZIATI;VIALE REGINA MARGHERITA 34/D;Messina;ME;Medicina di laboratorio - Aggregazione;Sede Operativa
ME;POLI ORTO FISIO SRL;VIA S. LIBERALE 6/D IS. 418;Messina;ME;Presidio ambulatoriali recupero riabilitazione;Sede Operativa
ME;POLIDIAGNOSTICO ALI' TERME SRL  ;VIA F. CRISPI 507;Acquedolci;ME;Poliambulatorio;Sede Operativa
ME;PROGETTO DOPO DI NOI COOPERATIVA SOCIALE ARL;Via Kennedy 217;Barcellona Pozzo di Gotto;ME;Centro diurno per soggetti affetti da disturbo autistico;Sede Operativa
ME;PUGLIA MARIA PIA SRL UNIPERSONALE;VIA FRANCAVILLA 42/A;Taormina;ME;Medicina di laboratorio;Sede Operativa
ME;QUOAD VALITUDINEM;S.S. 114 KM 4,300 CPL LE ANCORE;Messina;ME;Presidi di riabilitazione funzionale di portatori disabilità  fisiche psichiche e sensoriali;Sede Operativa
ME;RADIOLOGIA DIAGNOSTICA SRL;VIA W. VON GLOEDEN  63/65;Taormina;ME;Radiologia;Sede Operativa
ME;RIABILITAZIONE E FISIOTERAPIA CILIA SRL;VIALE SAN MARTINO IS. 13  396;Messina;ME;Presidio ambulatoriali recupero riabilitazione;Sede Operativa
ME;S STEFANO UNILAB SRL;VIA GARIBALDI 59;Tusa;ME;Medicina di laboratorio - Aggregazione;Punto Prelievo
ME;S STEFANO UNILAB SRL;corso Donadei 26;Alcara Li Fusi;ME;Medicina di laboratorio - Aggregazione;Punto Prelievo
ME;S STEFANO UNILAB SRL;via Umberto 112;Caronia;ME;Medicina di laboratorio - Aggregazione;Punto Prelievo
ME;S STEFANO UNILAB SRL;via S. Filippo di Fragalà  26;Frazzanò;ME;Medicina di laboratorio - Aggregazione;Punto Prelievo
ME;S STEFANO UNILAB SRL;contrada Buonriposo;Acquedolci;ME;Medicina di laboratorio - Aggregazione;Punto di accesso
ME;S STEFANO UNILAB SRL;via Baldisseri 14;Sant'Agata di Militello;ME;Medicina di laboratorio - Aggregazione;Punto di accesso
ME;S STEFANO UNILAB SRL;via Marina 80;Santo Stefano di Camastra;ME;Medicina di laboratorio - Aggregazione;Punto di accesso
ME;S STEFANO UNILAB SRL; VIA MARINA N. 80 -   ;Santo Stefano di Camastra;ME;Medicina di laboratorio - Aggregazione;Sede Operativa
ME;SALUS SRL;VIA S. ANTONIO 12/B;Patti;ME;Radiologia;Sede Operativa
ME;SAN FILIPPO DIAL CENTER SRL;VIA SANTA BARBARA ANG. ON GERMANA';Brolo;ME;Dialisi;Sede Operativa
ME;SAN FRANCESCO DELLA DSSA PIDALA' MELINA E C SNC;VIA ISTRIA  34;Messina;ME;Medicina di laboratorio;Sede Operativa
ME;SAN LUCA ANALISI CLINICHE SRL;VIA JACI 36;Messina;ME;Medicina di laboratorio;Sede Operativa
ME;SAN MICHELE SRL;VIA NINO BIXIO IS. 119, ISOL 114;Messina;ME;Radiologia;Sede Operativa
ME;SANATRIX SAS DEL DOTT GAETANO PANEBIANCO & C;VIA ROMA  52;Furci Siculo;ME;Medicina di laboratorio;Sede Operativa
ME;SANITAS  2 SRL;VIA C. COLOMBO 27 PALAZZO ALIFIA;Milazzo;ME;Medicina di laboratorio;Sede Operativa
ME;SANITAS SRL;VIA C. COLOMBO 7 PAL. CAMINITI;Milazzo;ME;Radiologia Diagnostica;Sede Operativa
