ASP;Denominazione;Indirizzo;Citta';Provincia;Attivita';Tipo sede
ME;ASSOCIAZIONE LELAT (LEGA LOTTA AIDS E TOSSICODIPENDENZE);VIA GAETANO ALESSI 74 (RIONE MANGIALUPI);Messina;Messina;Strutture riabilitazione ed educative assistenziali per dipendenti sostanze d'abuso;Sede Operativa
ME;ASSOCIAZIONE TRE ALI ONLUS;VIA LA FARINA 7;Messina;Messina;Presidi di riabilitazione funzionale di portatori disabilit fisiche psichiche e sensoriali;Sede Operativa
ME;AUTISMO ASSOCIAZIONE TEMPORANEA TRA ONLUS;VIA OLIVARELLA SNC;Nizza di Sicilia;Messina;Centro diurno per soggetti affetti da disturbo autistico;Sede Operativa
ME;AZIENDA SANITARIA POLIDIAGNOSTICA KENNEDY SRL;VIA KENNEDY 43/45;Brolo;Messina;Medicina di laboratorio;Sede Operativa
ME;BENEROM SWEDISH CLUB DI SACCA' MARIO E C SAS;VIA MEDICI 26;Sant'Agata di Militello;Messina;Presidio ambulatoriali recupero riabilitazione;Sede Operativa
ME;CAPP 1990 COOPERATIVA SOCIALE;VIA KENNEDY 21/B ;Patti;Messina;Presidi di riabilitazione funzionale di portatori disabilit fisiche psichiche e sensoriali;Sede Operativa
ME;CARDIO CENTER SAS DEL DOTT ROBERTO CARUSO;Via Catania is 1/2 469 palazzo Palano;Messina;Messina;Cardiologia;Sede Operativa
ME;CARDIO STUDIO SAS DI G ED S CUTUGNO & C;VIALE EUROPA 83/M IS. 47/B;Messina;Messina;Cardiologia;Sede Operativa
ME;CARDIONOVA SAS DI MAJOLINO MARIO E STELLA BRIENZA LUIGI E C SAS;VIA TORRENTE TRAPANI CASE PARISI PAL B;Messina;Messina;Cardiologia;Sede Operativa
ME;CASA DI CURA CAPPELLANI GIOMI ;VIALE REGINA ELENA 335 ;Messina;Messina;Casa di cura;Sede Operativa
ME;CASA DI CURA CARMONA ;V.LE P.PE UMBERTO 75/G;Messina;Messina;Casa di cura;Sede Operativa
ME;CASA DI CURA COT CURE ORTOPEDICHE TRAUMATOLOGICHE;VIA DUCEZIO 1;Messina;Messina;Attivit ambulatoriale case di cura private;Sede Operativa
ME;CASA DI CURA COT CURE ORTOPEDICHE TRAUMATOLOGICHE ;VIA DUCEZIO 1;Messina;Messina;Casa di cura;Sede Operativa
ME;CASA DI CURA CRISTO RE ;VIALE P.PE UMBERTO 89;Messina;Messina;Attivit ambulatoriale case di cura private;Sede Operativa
ME;CASA DI CURA CRISTO RE ;VIALE P. UMBERTO 89;Messina;Messina;Casa di cura;Sede Operativa
ME;CASA DI CURA GIOMI SPA ISTITUTO ORTOPEDICO DEL MEZZOGIORNO D'ITALIA F SCALABRINO;VIA CONSOLARE POMPEA 360;Messina;Messina;Attivit ambulatoriale case di cura private;Sede Operativa
ME;CASA DI CURA GIOMI SPA ISTITUTO ORTOPEDICO DEL MEZZOGIORNO D'ITALIA F SCALABRINO;VIA CONSOLARE POMPEA 360;Messina;Messina;Casa di cura;Sede Operativa
ME;CASA DI CURA S CAMILLO;VIALE PRINCIPE UMBERTO 71;Messina;Messina;Attivit ambulatoriale case di cura private;Sede Operativa
ME;CASA DI CURA S CAMILLO;VIALE PRINCIPE UMBERTO 71;Messina;Messina;Casa di cura;Sede Operativa
ME;CASA DI CURA VILLA IGEA ;VIA CONSOLARE VALERIA 45/47 ;Messina;Messina;Casa di cura;Sede Operativa
ME;CASA DI CURA VILLA IGEA SRL;VIA CONSOLARE VALERIA 45/47 ;Messina;Messina;Attivit ambulatoriale case di cura private;Sede Operativa
ME;CASA DI CURA VILLA SALUS;VIALE REGINA MARGHERITA 15/B;Messina;Messina;Attivit ambulatoriale case di cura private;Sede Operativa
ME;CASA DI CURA VILLA SALUS ;VIALE REGINA MARGHERITA 15/B;Messina;Messina;Casa di cura;Sede Operativa
ME;CDF CENTRO DIAGNOSTICO FIORELLO SAS ANALISI CLINICHE DI FIORELLO SANTINA;VIA MANCINI 18;Capo d'Orlando;Messina;Medicina di laboratorio;Sede Operativa
ME;CENTRO CRISAFULLI ORTOPEDIA, MEDICINA FISICA E RIABILITATIVA SAS DELLA DOTTSSA DANIELA CRISAFULLI & C;VIALE CADORNA IS. 212;Messina;Messina;Presidio ambulatoriali recupero riabilitazione;Sede Operativa
ME;CENTRO DI FISIOKINESITERAPIA QUATTROCCHI AGOSTINO DI SACCA' MARIO E BONFIGLIO CHILLEMI FELICIA SAS ;VIA KENNEDY ANG. VIA GARIBALDI;Barcellona Pozzo di Gotto;Messina;Presidio ambulatoriali recupero riabilitazione;Sede Operativa
ME;CENTRO DI MEDICINA RIABILITATIVA AMMANNATO SRL;S.S. 114 102 CONTESSE;Messina;Messina;Presidio ambulatoriali recupero riabilitazione;Sede Operativa
ME;CENTRO DI MEDICINA RIABILITATIVA DOTTSSA ANNAMARIA MARCHESE SAS;VAI CAMPO SPORTIVO 21;Santa Teresa di Riva;Messina;Presidio ambulatoriali recupero riabilitazione;Sede Operativa
ME;CENTRO DI SOLIDARIETA' FARO SOCIETA' COOPERATIVA SOCIALE;VIA SAN JACHIDDU 74;Messina;Messina;Strutture riabilitazione ed educative assistenziali per dipendenti sostanze d'abuso;Sede Operativa
ME;CENTRO DIAGNOSTICA PER IMMAGINI SRL;VIA CAMPO SPORTIVO 21;Santa Teresa di Riva;Messina;Radiologia;Sede Operativa
ME;CENTRO DIAGNOSTICO BOCCETTA SRL;VIA FAUSTINA E TERTULLO IS. 356;Messina;Messina;Medicina di laboratorio;Sede Operativa
ME;CENTRO DIAGNOSTICO CARDIOVASCOLARE DI GRECO ANNA MARIA E C SAS;VIA PRIVATA P. BORSELLINO 37;Milazzo;Messina;Cardiologia;Sede Operativa
ME;CENTRO DIAGNOSTICO CRISTINA SC A RL;VIA PIETRO NENNI 9-11;Santa Lucia del Mela;Messina;Medicina di laboratorio - Aggregazione;Punto di accesso
ME;CENTRO DIAGNOSTICO CRISTINA SC A RL;via S. Anna 68;Falcone;Messina;Medicina di laboratorio - Aggregazione;Punto di accesso
ME;CENTRO DIAGNOSTICO CRISTINA SC A RL;via Consolare Pompea 1383;Messina;Messina;Medicina di laboratorio - Aggregazione;Punto di accesso
ME;CENTRO DIAGNOSTICO CRISTINA SC A RL;via Citarella is. 78;Messina;Messina;Medicina di laboratorio - Aggregazione;Punto di accesso
ME;CENTRO DIAGNOSTICO CRISTINA SC A RL;corso Cavour 74;Messina;Messina;Medicina di laboratorio - Aggregazione;Punto di accesso
ME;CENTRO DIAGNOSTICO CRISTINA SC A RL;via Romagnosi 18;Messina;Messina;Medicina di laboratorio - Aggregazione;Punto di accesso
ME;CENTRO DIAGNOSTICO CRISTINA SC A RL;via Giardino 1;Montalbano Elicona;Messina;Medicina di laboratorio - Aggregazione;Punto Prelievo
ME;CENTRO DIAGNOSTICO CRISTINA SC A RL ;VIA KENNEDY N. 500;Barcellona Pozzo di Gotto;Messina;Medicina di laboratorio - Aggregazione;Sede Operativa
ME;CENTRO DIAGNOSTICO MESSINA SUD SRL;SS 114 KM 5,400 TREMESTIERI;Messina;Messina;Radiologia;Sede Operativa
ME;CENTRO DIURNO LAM 85;CONTRADA ZUCCHERA 2 - VILL. SANT'AGATA;Messina;Messina;Strutture riabilitazione ed educative assistenziali per dipendenti sostanze d'abuso;Sede Operativa
ME;CENTRO MEDICO DENTISTICO LA SPADA SAS & C DEI DOTT GIUSEPPE E ROSARIO LA SPADA;VIA CADUTI SUL LAVORO 25;Barcellona Pozzo di Gotto;Messina;Odontoiatria;Sede Operativa
ME;CENTRO NAVACITA (ASS SORGE IL SOLE ONLUS);C.DA CRESTA;Naso;Messina;Centro diurno per soggetti affetti da disturbo autistico;Sede Operativa
ME;CENTRO NUCLEARE SAS DI GENOVESE ADELE & C;VIA TRIESTE 48;Barcellona Pozzo di Gotto;Messina;Radiologia;Sede Operativa
ME;CENTRO OFTALMICO REGIS SAS DI MEZZANO OSCAR E C;via M. Regis 65 ;Milazzo;Messina;Oculistica;Sede Operativa
ME;CENTRO SERVIZI MEDICI SC A RL;via S. Ermanno 1;Messina;Messina;Medicina di laboratorio - Aggregazione;Punto di accesso
ME;CENTRO SERVIZI MEDICI SC A RL;via Canova 149 isol. 5;Messina;Messina;Medicina di laboratorio - Aggregazione;Punto di accesso
ME;CENTRO SERVIZI MEDICI SC A RL;via Rosario 45;Francavilla di Sicilia;Messina;Medicina di laboratorio - Aggregazione;Punto di accesso
ME;CENTRO SERVIZI MEDICI SC A RL;VIA VITTORIO EMANUELE 75;Giardini-Naxos;Messina;Medicina di laboratorio - Aggregazione;Punto di accesso
ME;CENTRO SERVIZI MEDICI SC A RL;via Silipigni 7;Taormina;Messina;Medicina di laboratorio - Aggregazione;Punto di accesso
ME;CENTRO SICILIANO DI NEFROLOGIA E DIALISI;C.DA FAVATA';Santo Stefano di Camastra;Messina;Dialisi;Sede Operativa
ME;CENTRO TERAPIA DI GREGORIO & C SAS;VIA TOMMASO CANNIZZARO 219;Messina;Messina;Presidio ambulatoriali recupero riabilitazione;Sede Operativa
ME;COD SRL;VIA CONSOLARE VALERIA 64;Acquedolci;Messina;Odontoiatria;Sede Operativa
ME;CONSORZIO D'AMICO 1980;via Nazionale 50/P;Torregrotta;Messina;Medicina di laboratorio - Aggregazione;Punto di accesso
ME;CONSORZIO D'AMICO 1980;via Nazionale 88;Villafranca Tirrena;Messina;Medicina di laboratorio - Aggregazione;Punto di accesso
ME;CONSORZIO D'AMICO 1980;via della Concordia 45;Milazzo;Messina;Medicina di laboratorio - Aggregazione;Punto di accesso
ME;CONSORZIO D'AMICO 1980;VIA NAZIONALE N. 50/P - FRAZIONE SCALA - ;Torregrotta;Messina;Medicina di laboratorio - Aggregazione;Sede Operativa
ME;CONSULTORIO AIED ASSOCIAZIONE ITALIANA EDUCAZIONE DEMOGRAFICA;VIA GIUSEPPE CAPORALE 83/85 LOC. S. AGATA;Messina;Messina;Consultorio;Sede Operativa
ME;CONSULTORIO FAMILIARE UCIPEM ONLUS;VIA CALAMARO, 13;Villafranca Tirrena;Messina;Consultorio;Sede Operativa
ME;CRU - CENTRO DI RIPRODUZIONE UMANA SRL;VIA TRENTO 20;Messina;Messina;Procreazione Medicalmente Assistita;Sede Operativa
ME;CTA KENNEDY SRL;VIA KENNEDY 1;Saponara;Messina;Comunit Terapeutica Assistita;Sede Operativa
ME;CTA KENNEDY SRL;VIA XXIV MAGGIO 155;Messina;Messina;Comunit Terapeutica Assistita;Sede Operativa
ME;DIAGNOSTICA ARCHIMEDE SRL;VIA ARCHIMEDE 8;Sant'Agata di Militello;Messina;Medicina di laboratorio;Sede Operativa
ME;DIAGNOSTICA DEI VERDI SRL;VIA DEI VERDI 58;Messina;Messina;Medicina di laboratorio;Sede Operativa
ME;DIAVERUM ITALIA SRL;VIA GENERALE ANGELO CAMBRIA 2;Barcellona Pozzo di Gotto;Messina;Dialisi;Sede Operativa
ME;DISMED CENTRO STUDI PER LE DISABILITA' DEL MEDITERRANEO - ASSOCIAZIONE ONLUS;VIA TRIESTE 3 C.DA CUSOLITO - FARO SUPERIORE;Messina;Messina;Presidi di riabilitazione funzionale di portatori disabilit fisiche psichiche e sensoriali;Sede Operativa
ME;DOTT ALFIO SAPIA;S.S. 114 KM. 3,500 TOP RESIDENCE;Messina;Messina;Dermatologia;Sede Operativa
ME;DOTT PIETRO MAZZAGATTI;VIA XXI OTTOBRE 606;Torregrotta;Messina;Odontoiatria;Sede Operativa
ME;DOTT SALVIERA CARLO;VIA GHIBELLINA 135;Messina;Messina;Otorinolaringoiatria;Sede Operativa
ME;DOTT SILVESTRO MARTELLA;VIA CONSOLARE POMPEA 1741;Messina;Messina;Medicina di laboratorio;Sede Operativa
ME;DOTT STELLA BRIENZA LUCIA SAS;VIA NAZIONALE 182/B VILLAGGIO S. MARGHERITA;Messina;Messina;Medicina di laboratorio;Sede Operativa
ME;DOTT TRIFIRO' ANTONIO FRANCO ODONTOIATRIA E PROTESI DENTARIA;VIA GIOVANNI VERGA 26;Sant'Agata di Militello;Messina;Odontoiatria;Sede Operativa
ME;DOTT.MASSIMO NATALE SRL;VIA CONSOLARE ANTICA 562/C;Capo d'Orlando;Messina;Odontoiatria;Sede Operativa
ME;DOTTSSA ROSANNA VIOLA;VIALE DELLA LIBERTA'  115;Messina;Messina;Odontoiatria;Sede Operativa
ME;ECAS SAS DEL DOTT POLITO DOMENICO E FIGLI;VIA DEI MILLE 20;Milazzo;Messina;Cardiologia;Sede Operativa
ME;EMMI LAB DIAGNOSTICA SC A RL;Piazzale Mercato Complesso I Portici;Santa Teresa di Riva;Messina;Medicina di laboratorio - Aggregazione;Punto di accesso
ME;EMMI LAB DIAGNOSTICA SC A RL;via Damiano Rosso 2;Taormina;Messina;Medicina di laboratorio - Aggregazione;Punto di accesso
ME;EMMI LAB DIAGNOSTICA SC A RL ;VIA DAMIANO ROSSO N. 2;Taormina;Messina;Medicina di laboratorio - Aggregazione;Sede Operativa
ME;EMODIAGNOSTICA SAS DI FRANCHINA GIUSEPPE E C;VIA ROMA 15;Tortorici;Messina;Medicina di laboratorio;Sede Operativa
ME;EMOLAB DOTT ANGELO SINDONI & C SAS;VIA NAZIONALE 206;Villafranca Tirrena;Messina;Medicina di laboratorio;Sede Operativa
ME;EUROGESTIONI SPA - IL GIARDINO SUI LAGHI ;VIA CONSOLARE POMPEA 1935;Messina;Messina;Residenza Sanitaria Assistita;Sede Operativa
ME;EVA SRL;VIALE ITALIA 1;Messina;Messina;Medicina di laboratorio;Sede Operativa
ME;EVA SRL;VIALE ITALIA 1;Messina;Messina;Radiologia Diagnostica;Sede Operativa
ME;FISIOKINESITERAPIA MALFA SRL;VIA UGO SANT'ONOFRIO N. 89;Barcellona Pozzo di Gotto;Messina;Presidio ambulatoriali recupero riabilitazione;Sede Operativa
ME;FKT SAS DI BUEMI & C;PIAZZA NASTASI 3/4;Milazzo;Messina;Presidio ambulatoriali recupero riabilitazione;Sede Operativa
ME;GENOVESE HUB;VIA ROMA 79;Barcellona Pozzo di Gotto;Messina;Medicina di laboratorio - Aggregazione;Sede Operativa
ME;GENOVESE HUB;VIA ROMA 79;Barcellona Pozzo di Gotto;Messina;Medicina di laboratorio - Aggregazione;Punto di accesso
ME;GENOVESE HUB;VIA STAZIONE N 5;Falcone;Messina;Medicina di laboratorio - Aggregazione;Punto di accesso
ME;IL CUORE - DIAGNOSTICA E PREVENZIONE CARDIOVASCOLARE DELLA DSSA CARMELINA SIGNORINO & C SAS;VIA CONSOLARE VALERIA 118 E;Giardini-Naxos;Messina;Cardiologia;Sede Operativa
ME;IPPOCRATE PADRE PIO;VIA CESARE BATTISTI CONTRADA LITANIA;Furci Siculo;Messina;Dialisi;Sede Operativa
ME;LA DIAGNOSTICA DI LURASCHI MARIANNA NUNZIATA & C SAS;VIA ROMA 325;Scaletta Zanclea;Messina;Medicina di laboratorio;Sede Operativa
ME;LA DIAGNOSTICA SC A RL;via Vittorio Veneto 13;Milazzo;Messina;Medicina di laboratorio - Aggregazione;Punto di accesso
ME;LA DIAGNOSTICA SC A RL;viale Italia 1;Messina;Messina;Medicina di laboratorio - Aggregazione;Punto di accesso
ME;LA DIAGNOSTICA SC A RL;via Ugo Bassi 128;Messina;Messina;Medicina di laboratorio - Aggregazione;Punto di accesso
ME;LA DIAGNOSTICA SC A RL;via Ghibellina 45 is. 282;Messina;Messina;Medicina di laboratorio - Aggregazione;Punto di accesso
ME;LA DIAGNOSTICA SC A RL;viale San Martino 401 is. 12;Messina;Messina;Medicina di laboratorio - Aggregazione;Punto di accesso
ME;LA DIAGNOSTICA SC A RL;via 37/A Fondofucile;Messina;Messina;Medicina di laboratorio - Aggregazione;Punto di accesso
ME;LA DIAGNOSTICA SC A RL;VIA VITTORIO VENETO N. 15 - ;Milazzo;Messina;Medicina di laboratorio - Aggregazione;Sede Operativa
ME;LA FAMIGLIA;VIA S. PALADINO 12;Giardini-Naxos;Messina;Consultorio;Sede Operativa
ME;LA MADONNINA SRL;VIA CONSOLARE STRADELLA;Capo d'Orlando;Messina;Poliambulatorio;Sede Operativa
ME;LA RINASCENTE SAS DI ANTONINO TRIFIRO' E LUCIANA IMPALLOMENI & C SAS;VIA DEI MILLE IS. 101 n. 243;Messina;Messina;Presidio ambulatoriali recupero riabilitazione;Sede Operativa
ME;LAB ANALISI CLINICHE DOTT CARMELO SAITTA SRL;VIA UMBERTO I 380;Roccalumera;Messina;Medicina di laboratorio;Sede Operativa
ME;LAB QUALITY CONTROL SRL;VIA GIOVANNI DEL MAESTRO 8;Messina;Messina;Medicina di laboratorio;Sede Operativa
ME;LABORATORIO ANALISI CLINICHE CATALIOTO MARIA;VIA PIRANDELLO 13;Sant'Agata di Militello;Messina;Medicina di laboratorio;Sede Operativa
ME;LABORATORIO ANALISI CLINICHE CEIBA DI MASCALI ANTONIO E RUSSO SEBASTIANO SNC;VIA TEVERE;Giardini-Naxos;Messina;Medicina di laboratorio;Sede Operativa
ME;LABORATORIO ANALISI CLINICHE DEI DOTTORI ARAGONA GIUSEPPE E ARAGONA PIETRO SNC;VIA B. CROCE 24;Barcellona Pozzo di Gotto;Messina;Medicina di laboratorio;Sede Operativa
ME;LABORATORIO ANALISI CLINICHE DEL DOTT TOMASI ANTONINO E C SAS;VIA NAZIONALE 282/284;Capri Leone;Messina;Medicina di laboratorio;Sede Operativa
ME;LABORATORIO ANALISI CLINICHE LOMBARDO ANNA;VIA VITT. EMANUELE 55/57;Giardini-Naxos;Messina;Medicina di laboratorio;Sede Operativa
ME;LABORATORIO ANALISI CLINICHE NAXOS;VIA MAZZINI 15;Naso;Messina;Medicina di laboratorio;Sede Operativa
ME;LABORATORIO ANALISI DI DI BERNARDO S & C SAS;VIA UMBERTO I 21/23;Barcellona Pozzo di Gotto;Messina;Medicina di laboratorio;Sede Operativa
ME;LABORATORIO ANALISI DOTT STEFANO LA SPADA E DOTT MARCELLO GALI' SNC ;VIA COLLODI 1;Spadafora;Messina;Medicina di laboratorio;Sede Operativa
ME;LABORATORIO ANALISI DOTTSSA TRIFILO' GISELLA;VIA CATANIA 20;Sant'Agata di Militello;Messina;Medicina di laboratorio;Sede Operativa
ME;LABORATORIO ANALISI S ALESSIO;VIA CONSOLARE VALERIA 14;Sant'Alessio Siculo;Messina;Medicina di laboratorio;Sede Operativa
ME;LABORATORIO DI ANALISI CLINICHE BOMBARA DI MORABITO DOMENICA & C SAS;VIA SAN MARTINO 246;Messina;Messina;Medicina di laboratorio;Sede Operativa
ME;LABORATORIO DI ANALISI CLINICHE DEL DOTT BONGIORNO GIUSEPPE E FIGLIA SNC;VIA SERPI 53;San Fratello;Messina;Medicina di laboratorio;Sede Operativa
ME;LABORATORIO DI ANALISI CLINICHE SAN NICOLO';VIA UMBERTO I 211/A;Gioiosa Marea;Messina;Medicina di laboratorio;Sede Operativa
ME;LABORATORIO DI ANALISI DI STEFANO SRL;VIA RISORGIMENTO 93;Messina;Messina;Medicina di laboratorio;Sede Operativa
ME;LABORATORIO DIAGNOSTICO BERTUCCI DI P GROSSO E G BUDA SNC;VIA CENTONZE 101;Messina;Messina;Medicina di laboratorio;Sede Operativa
ME;LABORATORIO DIAGNOSTICO DOTTRI SEBASTIANO E CLAUDIO CANFORA SRL;VIALE SAN MARTINO IS. 56 315;Messina;Messina;Medicina di laboratorio;Sede Operativa
ME;LABORATORIO S RITA SNC DI TRIFILO' ENNIO MARIA E FIGLI;VIA LUIGI PIRANDELLO 49;Capo d'Orlando;Messina;Medicina di laboratorio;Sede Operativa
ME;LABORATORIO SCIENTIFICO DOTT ROSETTA PANZERA DI GAETANO CAUDULLO E C SNC;VIA CATANIA IS. 1/2;Messina;Messina;Medicina di laboratorio;Sede Operativa
ME;LABOS SRL AMBULATORIO NEFROLOGIA ED EMODIALISI;VIA LIBERTA' 127;Pace del Mela;Messina;Dialisi;Sede Operativa
ME;MEDICAL CENTER SRL;VIA MARINA 163;Nizza di Sicilia;Messina;Presidi di riabilitazione funzionale di portatori disabilit fisiche psichiche e sensoriali;Sede Operativa
ME;MEDICAL CENTER SRL;VIA MARINA 163 PIANO PRIMO;Nizza di Sicilia;Messina;Presidio ambulatoriali recupero riabilitazione;Sede Operativa
ME;MEDICAL SYSTEM DELLA DOTTSSA GIOVANNA SCHEPIS & C SAS;VIA GARIBALDI 9 FRAZ. GIAMMORO;Pace del Mela;Messina;Medicina di laboratorio;Sede Operativa
ME;NEPHROCARE SPA;VIA MARCO POLO 499;Messina;Messina;Dialisi;Sede Operativa
ME;NEPHROCARE SPA;SS 114 KM 10 GALATI MARINA;Messina;Messina;Dialisi;Sede Operativa
ME;NOVAMEDICA SNC DEL DOTT ROSARIO COSTA E C;VIA DEI MILLE IS. 88 n. 265;Messina;Messina;Presidio ambulatoriali recupero riabilitazione;Sede Operativa
ME;ODONTO CENTER SAS;PIAZZA NASTASI 31/32;Milazzo;Messina;Odontoiatria;Sede Operativa
ME;ODONTOMAX SAS DI DOMENICO BUDA & C;VIA MONS. PAINO 14;Barcellona Pozzo di Gotto;Messina;Odontoiatria;Sede Operativa
ME;OMEGA CENTRO DIALISI SRL;VIA CONCA D'ORO PAL. 1/S S.S. ANNUNZIATA;Messina;Messina;Dialisi;Sede Operativa
ME;OPUS RESIDENTIAL SRL ;VIA XXIV MAGGIO 155;Messina;Messina;Residenza Sanitaria Assistita;Sede Operativa
ME;PASTEUR CENTRI DIAGNOSTICI CONSORZIATI;VIALE REGINA MARGHERITA 34/D;Messina;Messina;Medicina di laboratorio - Aggregazione;Sede Operativa
ME;PASTEUR CENTRI DIAGNOSTICI CONSORZIATI;VIALE REGINA MARGHERITA 34/D;Messina;Messina;Medicina di laboratorio - Aggregazione;Punto di accesso
ME;PASTEUR CENTRI DIAGNOSTICI CONSORZIATI;VIA VITTORIO VENETO 18;Sinagra;Messina;Medicina di laboratorio - Aggregazione;Punto Prelievo
ME;PASTEUR CENTRI DIAGNOSTICI CONSORZIATI;VIA SUBIESCHI 2;Mistretta;Messina;Medicina di laboratorio - Aggregazione;Punto di accesso
ME;PASTEUR CENTRI DIAGNOSTICI CONSORZIATI;VIA XXIV MAGGIO 21;Lipari;Messina;Medicina di laboratorio - Aggregazione;Punto di accesso
ME;PASTEUR CENTRI DIAGNOSTICI CONSORZIATI;S.S. 114 KM 5,400 PISTUNINA;Messina;Messina;Medicina di laboratorio - Aggregazione;Punto di accesso
ME;POLI ORTO FISIO SRL;VIA S. LIBERALE 6/D IS. 418;Messina;Messina;Presidio ambulatoriali recupero riabilitazione;Sede Operativa
ME;POLIDIAGNOSTICO ALI' TERME SRL ;VIA F. CRISPI 507;Acquedolci;Messina;Poliambulatorio;Sede Operativa
ME;PROGETTO DOPO DI NOI COOPERATIVA SOCIALE ARL;Via Kennedy 217;Barcellona Pozzo di Gotto;Messina;Centro diurno per soggetti affetti da disturbo autistico;Sede Operativa
ME;PUGLIA MARIA PIA SRL UNIPERSONALE;VIA FRANCAVILLA 42/A;Taormina;Messina;Medicina di laboratorio;Sede Operativa
ME;QUOAD VALITUDINEM;S.S. 114 KM 4,300 CPL LE ANCORE;Messina;Messina;Presidi di riabilitazione funzionale di portatori disabilit fisiche psichiche e sensoriali;Sede Operativa
ME;RADIOLOGIA DIAGNOSTICA SRL;VIA W. VON GLOEDEN 63/65;Taormina;Messina;Radiologia;Sede Operativa
ME;RIABILITAZIONE E FISIOTERAPIA CILIA SRL;VIALE SAN MARTINO IS. 13 396;Messina;Messina;Presidio ambulatoriali recupero riabilitazione;Sede Operativa
ME;S STEFANO UNILAB SRL;VIA MARINA N. 80 -  ;Santo Stefano di Camastra;Messina;Medicina di laboratorio - Aggregazione;Sede Operativa
ME;S STEFANO UNILAB SRL;VIA GARIBALDI 59;Tusa;Messina;Medicina di laboratorio - Aggregazione;Punto Prelievo
ME;S STEFANO UNILAB SRL;corso Donadei 26;Alcara Li Fusi;Messina;Medicina di laboratorio - Aggregazione;Punto Prelievo
ME;S STEFANO UNILAB SRL;via Umberto 112;Caronia;Messina;Medicina di laboratorio - Aggregazione;Punto Prelievo
ME;S STEFANO UNILAB SRL;via S. Filippo di Fragal 26;;Messina;Medicina di laboratorio - Aggregazione;Punto Prelievo
ME;S STEFANO UNILAB SRL;via Baldisseri 14;Sant'Agata di Militello;Messina;Medicina di laboratorio - Aggregazione;Punto di accesso
ME;S STEFANO UNILAB SRL;via Marina 80;Santo Stefano di Camastra;Messina;Medicina di laboratorio - Aggregazione;Punto di accesso
ME;S STEFANO UNILAB SRL;contrada Buonriposo;Acquedolci;Messina;Medicina di laboratorio - Aggregazione;Punto di accesso
ME;SALUS SRL;VIA S. ANTONIO 12/B;Patti;Messina;Radiologia;Sede Operativa
ME;SAN FILIPPO DIAL CENTER SRL;VIA SANTA BARBARA ANG. ON GERMANA';Brolo;Messina;Dialisi;Sede Operativa
ME;SAN FRANCESCO DELLA DSSA PIDALA' MELINA E C SNC;VIA ISTRIA 34;Messina;Messina;Medicina di laboratorio;Sede Operativa
ME;SAN LUCA ANALISI CLINICHE SRL;VIA JACI 36;Messina;Messina;Medicina di laboratorio;Sede Operativa
ME;SAN MICHELE SRL;VIA NINO BIXIO IS. 119, ISOL 114;Messina;Messina;Radiologia;Sede Operativa
ME;SANATRIX SAS DEL DOTT GAETANO PANEBIANCO & C;VIA ROMA 52;Furci Siculo;Messina;Medicina di laboratorio;Sede Operativa
ME;SANITAS 2 SRL;VIA C. COLOMBO 27 PALAZZO ALIFIA;Milazzo;Messina;Medicina di laboratorio;Sede Operativa
ME;SANITAS SRL;VIA C. COLOMBO 27 PAL. ALIFIA;Messina;Messina;Presidio ambulatoriali recupero riabilitazione;Sede Operativa
ME;SANITAS SRL;VIA C. COLOMBO 7 PAL. CAMINITI;Milazzo;Messina;Radiologia Diagnostica;Sede Operativa
ME;SOCIETA' COOPERATIVA SOCIALE FARO 85 ONLUS - RSA S LUIGI ORIONE;VIALE SAN MARTINO 338;Messina;Messina;Residenza Sanitaria Assistita;Sede Operativa
ME;SOCIETA' SERVIZI RIABILITATIVI;1. VIA STAZIONE CONTESSE 63 MESSINA - 2. VIA ;Messina;Messina;Presidi di riabilitazione funzionale di portatori disabilit fisiche psichiche e sensoriali;Sede Operativa
ME;SOCIETA' SERVIZI RIABILITATIVI;via Caduti sul Lavoro 35;Barcellona Pozzo di Gotto;Messina;Presidi di riabilitazione funzionale di portatori disabilit fisiche psichiche e sensoriali;Sede Operativa
ME;SOCIETA' SERVIZI RIABILITATIVI;contrada San Giovanni - Santo Spirito ;Patti;Messina;Presidi di riabilitazione funzionale di portatori disabilit fisiche psichiche e sensoriali;Sede Operativa
ME;SOCIETA' SERVIZI RIABILITATIVI;contrada Santa Lucia;Capo d'Orlando;Messina;Presidi di riabilitazione funzionale di portatori disabilit fisiche psichiche e sensoriali;Sede Operativa
ME;SOCIETA' SERVIZI RIABILITATIVI;contrada Olivarella ;Nizza di Sicilia;Messina;Presidi di riabilitazione funzionale di portatori disabilit fisiche psichiche e sensoriali;Sede Operativa
ME;SOCIETA' SERVIZI RIABILITATIVI;via Quasimodo ;Villafranca Tirrena;Messina;Presidi di riabilitazione funzionale di portatori disabilit fisiche psichiche e sensoriali;Sede Operativa
ME;SOCIETA' SERVIZI RIABILITATIVI;via Neviera snc ;Mistretta;Messina;Presidi di riabilitazione funzionale di portatori disabilit fisiche psichiche e sensoriali;Sede Operativa
ME;SOCIETA' SERVIZI RIABILITATIVI;Via San Giorgio;Lipari;Messina;Presidi di riabilitazione funzionale di portatori disabilit fisiche psichiche e sensoriali;Sede Operativa
ME;SPARVIERO SRL;VIA PIRANDELLO 80;Taormina;Messina;Dialisi;Sede Operativa
ME;STAF SRL;VIA L. PICCOLO 9;Capo d'Orlando;Messina;Radiologia;Sede Operativa
ME;STUDIO CARDIOLOGICO GARUFI SAS DEL DOTT SEBASTIANO MARIO GARUFI & C E DELLA DSSA ROSSELLA GARUFI;VIA LA FARINA ISOLATO 278 SCALA D;Messina;Messina;Cardiologia;Sede Operativa
ME;STUDIO CARDIOLOGICO RIZZO SAS DEL DOTT RIZZO GIAMBATTISTA & C;VIALE BOCCETTA 6 ISOL. 350;Messina;Messina;Cardiologia;Sede Operativa
ME;STUDIO DE BELLA BIOPATOLOGIA CLINICA DI F DE BELLA & C SAS ;VIA LA FARINA 171 IS. G;Messina;Messina;Medicina di laboratorio;Sede Operativa
ME;STUDIO DENTISTICO ASSOCIATO ALI' TAMA';VIA XXIV MAGGIO 28;Messina;Messina;Odontoiatria;Sede Operativa
ME;STUDIO DENTISTICO ASSOCIATO DEI DOTTORI LIZIO DI LIZIO PLACIDO & C;VIA G. LA FARINA 171;Messina;Messina;Odontoiatria;Sede Operativa
ME;STUDIO DENTISTICO ASSOCIATO DOTT CORTOLILLO A TAVIANO W CAMPISI G;VIA B. CAPUTO 143;Torrenova;Messina;Odontoiatria;Sede Operativa
ME;STUDIO DENTISTICO ASSOCIATO OTERI;VIA C. CITARRELLA 39;Messina;Messina;Odontoiatria;Sede Operativa
ME;STUDIO DENTISTICO BRIGUGLIO ;VIA LUNGOMARE 40;Santa Teresa di Riva;Messina;Odontoiatria;Sede Operativa
ME;STUDIO DENTISTICO DEL PROF ROBERTO BRIGUGLIO;VIA XXVII LUGLIO 40;Messina;Messina;Odontoiatria;Sede Operativa
ME;STUDIO DENTISTICO DELLA DOTTSSA M ZAGAMI E DI ESTER MORMINA SAS;VIA NAZIONALE 495;Spadafora;Messina;Odontoiatria;Sede Operativa
ME;STUDIO DENTISTICO DELLA DSSA ROSSELLI ANTONELLA ODONTOIATRIA E PROTESI DENTARIA;VIA TORRENTE TRAPANI 36;Messina;Messina;Odontoiatria;Sede Operativa
ME;STUDIO DENTISTICO DOTT ANNA MARIA DI PIETRO;VIA VITTORIO EMANUELE 1;Sinagra;Messina;Odontoiatria;Sede Operativa
ME;STUDIO DENTISTICO DOTT ANTONIO ORITI;VIA NAZIONALELE 55;Alcara Li Fusi;Messina;Odontoiatria;Sede Operativa
ME;STUDIO DENTISTICO DOTT ANTONIO ORITI;VIA CONSOLARE ANTICA 451;Capo d'Orlando;Messina;Odontoiatria;Sede Operativa
ME;STUDIO DENTISTICO DOTT GREGORIO SCALIA;VIA CESARE BATTISTI 1 ;Messina;Messina;Odontoiatria;Sede Operativa
ME;STUDIO DENTISTICO DOTTSSA GIULIA CATANESI;VIA BOCCETTA N. 40;Messina;Messina;Odontoiatria;Sede Operativa
ME;STUDIO DENTISTICO DR GIANNETTO GIUSEPPE;VIA DOGALI 50;Messina;Messina;Odontoiatria;Sede Operativa
ME;STUDIO DENTISTICO DSSA DOMENICA MASTROIENI;VIA PROF. SFAMEMI 90 - SCALA;Torregrotta;Messina;Odontoiatria;Sede Operativa
ME;STUDIO DENTISTICO MAIORANA SAS;VIA UMBERTO I 15;Milazzo;Messina;Odontoiatria;Sede Operativa
ME;STUDIO DENTISTICO MASTROIENI ;VIA ALDO MORO 71 - OLIVARELLA;San Filippo del Mela;Messina;Odontoiatria;Sede Operativa
ME;STUDIO DI ANALISI CLINICHE MANNINA E SALVO DEI DOTTORI MANNINA GIUSEPPE E SALVO GIULIANA & C SAS;VIA CUCINOTTI VIOLATO N. 8-12 (EX VIA FONDACO;Rometta;Messina;Medicina di laboratorio;Sede Operativa
ME;STUDIO DI ODONTOIATRIA ED ORTODONZIA DEI DOTTRI ROSALBA DI NATALE E GAETANO IANNELLO;VIA G. LA PIRA 1;Terme Vigliatore;Messina;Odontoiatria;Sede Operativa
ME;STUDIO DIAGNOSTICA IGEA SC A RL;VIA SAN GIOVANNI 80;Barcellona Pozzo di Gotto;Messina;Medicina di laboratorio - Aggregazione;Sede Operativa
ME;STUDIO DIAGNOSTICA IGEA SC A RL;via La Farina 141 is. L;Messina;Messina;Medicina di laboratorio - Aggregazione;Punto di accesso
