ASP;Denominazione;Indirizzo;Citta';Provincia;Attivita';Tipo sede
PA;CASA DI CURA COSENTINO;CORSO DEI MILLE 56;Palermo;Palermo;Casa di cura;Sede Operativa
PA;CENTRO ANDROS ;VIA AUSONIA 43/45;Palermo;Palermo;Day Surgery autonomo;Sede Operativa
PA;NUOVA CASA DI CURA DEMMA ;VIA ROMA 94;Palermo;Palermo;Radiologia;Sede Operativa
PA;AIAS ONLUS  PALERMO - SEZIONE BEN HAUCAL;VIA BEN HAUKAL 13;Palermo;Palermo;Presidi di riabilitazione funzionale di portatori disabilit fisiche psichiche e sensoriali;Sede Operativa
PA;AIAS ONLUS BELMONTE MEZZAGNO;VIA ANIME SANTE 24;Belmonte Mezzagno;Palermo;Presidi di riabilitazione funzionale di portatori disabilit fisiche psichiche e sensoriali;Sede Operativa
PA;AIAS ONLUS PALERMO - CENTRO BAGHERIA;VIA DANTE 28;Bagheria;Palermo;Presidi di riabilitazione funzionale di portatori disabilit fisiche psichiche e sensoriali;Sede Operativa
PA;AIAS ONLUS PALERMO - CENTRO GRAMSCI;VIA GRAMSCI 4/34;Palermo;Palermo;Presidi di riabilitazione funzionale di portatori disabilit fisiche psichiche e sensoriali;Sede Operativa
PA;AIAS ONLUS PALERMO - CENTRO PARUTA ;Via Paruta, n. 47-47/A-47/B;Palermo;Palermo;Presidi di riabilitazione funzionale di portatori disabilit fisiche psichiche e sensoriali;Sede Operativa
PA;AIAS ONLUS PALERMO - CENTRO RAITI;VIA RAITI 16;Palermo;Palermo;Presidi di riabilitazione funzionale di portatori disabilit fisiche psichiche e sensoriali;Sede Operativa
PA;AIAS ONLUS PALERMO - SEZIONE BERNINI;VIA BERNINI 4;Palermo;Palermo;Presidi di riabilitazione funzionale di portatori disabilit fisiche psichiche e sensoriali;Sede Operativa
PA;AIAS ONLUS PALERMO - SEZIONE BESIO ;VIA G. BESIO 73/79;Palermo;Palermo;Presidi di riabilitazione funzionale di portatori disabilit fisiche psichiche e sensoriali;Sede Operativa
PA;AIAS ONLUS PARTINICO ;VIA DE SANTIS S.N.C.;Partinico;Palermo;Presidi di riabilitazione funzionale di portatori disabilit fisiche psichiche e sensoriali;Sede Operativa
PA;AMBRA STUDIO MEDICO DEI DOTTORI ROBERTO PALERMO VINCENZO AGRIFOGLIO E PAOLA NAPOLI MEDICI E DELLA DOTTSSA ROSANNA CIRIMINNA BIOLOGA;VIALE REGINA MARGHERITA 5;Palermo;Palermo;Procreazione Medicalmente Assistita;Sede Operativa
PA;AMBULATORIO CARDIOLOGICO DI FRANCO DOTTSSA FIAMMETTA;VIA SCIUTI 87/C;Palermo;Palermo;Cardiologia;Sede Operativa
PA;AMBULATORIO CARDIOLOGICO DOTT GIANNOLA ANTONINO SAS;VIA RUGGERO SETTIMO 113-115-117;Terrasini;Palermo;Cardiologia;Sede Operativa
PA;AMBULATORIO CARDIOLOGICO SAS DI RIZZO DOTTSSA ROSA ;VIA F. SPECIALE 79;Palermo;Palermo;Cardiologia;Sede Operativa
PA;AMBULATORIO DI OSTETRICIA E GINECOLOGIA DELLA DOTTSSA BALDACCHINO MARIA PINA SAS;LARGO FRANCESCO GARUFI 8;Palermo;Palermo;Ostetricia e ginecologia;Sede Operativa
PA;AMBULATORIO DI OSTETRICIA E GINECOLOGIA DOTTSSA MARIA LETIZIA TOMASINO E C SAS;VIA L. SETTEMBRINI 4/A - 6;Palermo;Palermo;Ostetricia e ginecologia;Sede Operativa
PA;AMBULATORIO DIALISI E TERAPIA RENALE SRL;P.ZZA EUROPA 19/A;Palermo;Palermo;Dialisi;Sede Operativa
PA;AMBULATORIO MEDICO ODONTOIATRICO DEL DOTT FRANCESCO AMMIRATA;VIA NOTARBARTOLO 31;Palermo;Palermo;Odontoiatria;Sede Operativa
PA;AMBULATORIO OCULISTICO FOCUS SRL;Via Enrico Albanese, n. 17;Palermo;Palermo;Oculistica e chirurgia ambulatoriale;Sede Operativa
PA;AMBULATORIO ODONTOIATRICO MEDICI SRLS;VIA R. WAGNER 9;Palermo;Palermo;Odontoiatria;Sede Operativa
PA;AMBULATORIO ODONTOIATRICO CAROLLO DEI DOTTORI CAROLLO GASPARE E MARIO SAS;PIAZZA DEL POPOLO 2;San Giuseppe Jato;Palermo;Odontoiatria;Sede Operativa
PA;AMBULATORIO ODONTOIATRICO DEL DOTT ALESSANDRO GRANATELLI SAS ;VIA E. BERNABEI 19;Palermo;Palermo;Odontoiatria;Sede Operativa
PA;AMBULATORIO ODONTOIATRICO DEL DOTT AMATO SRL;C.SO CALATAFIMI 338;Palermo;Palermo;Odontoiatria;Sede Operativa
PA;AMBULATORIO ODONTOIATRICO DEL DOTT. DAVI' ROSARIO E C. S.A.S.;Via Claudio Monteverdi, n. 39;Palermo;Palermo;Odontoiatria;Sede Operativa
PA;AMBULATORIO ODONTOIATRICO DELLA DOTTORESSA GIULIA LIBERTI & C SAS;CORSO GAETANO SCARPELLO 13/15;Misilmeri;Palermo;Odontoiatria;Sede Operativa
PA;AMBULATORIO ODONTOIATRICO DELLA DOTTSSA VERONICA CAPUTO;CORSO FINOCCHIARO APRILE 15;Palermo;Palermo;Odontoiatria;Sede Operativa
PA;AMBULATORIO ODONTOIATRICO DI DOTT MALTESE VINCENZO & C SAS;VIA DON PINO PUGLISI 214 A/B;Belmonte Mezzagno;Palermo;Odontoiatria;Sede Operativa
PA;AMBULATORIO ODONTOIATRICO DI DRAGO DOTT FRANCESCO SALVATORE & C SNC;VIA PIRANDELLO 1;Palermo;Palermo;Odontoiatria;Sede Operativa
PA;AMBULATORIO ODONTOIATRICO DOTT CALIA SAS DI CALIA FRANCESCO & C;VIA CRISPI 83;Campofiorito;Palermo;Odontoiatria;Sede Operativa
PA;AMBULATORIO ODONTOIATRICO DOTT CARRILLO MARIA GRAZIA;VIA RESUTTANA 352;Palermo;Palermo;Odontoiatria;Sede Operativa
PA;AMBULATORIO ODONTOIATRICO DOTT CESARE GENOVA SRL;C.SO GARIBALDI 125;Carini;Palermo;Odontoiatria;Sede Operativa
PA;AMBULATORIO ODONTOIATRICO DOTT GIUSEPPE GARAFFA & C SAS;P.ZZA VITT. EMANUELE ORLANDO 6;Palermo;Palermo;Odontoiatria;Sede Operativa
PA;AMBULATORIO ODONTOIATRICO DOTT LO VOI ANTONIO;VIA DECANO DI VINCENTI 3;Bisacquino;Palermo;Odontoiatria;Sede Operativa
PA;AMBULATORIO ODONTOIATRICO DOTT SALVATORE VALERIO;VIA VENERO 109;Monreale;Palermo;Odontoiatria;Sede Operativa
PA;AMBULATORIO ODONTOIATRICO DOTT SERRADIFALCO ANGELO;VIA LIBERTA' 67/A;Prizzi;Palermo;Odontoiatria;Sede Operativa
PA;AMBULATORIO ODONTOIATRICO DOTTORATO SAS DELLA DOTTSSA DOTTORATO CATERINA;VIA MAURICI 14/16;Villafrati;Palermo;Odontoiatria;Sede Operativa
PA;AMBULATORIO ODONTOIATRICO DOTTSSA MARILINA GANDOLFO;C.SO CALATAFIMI 202;Palermo;Palermo;Odontoiatria;Sede Operativa
PA;AMBULATORIO ODONTOIATRICO DOTTSSA NUTRICATO MARIA GRAZIA & C SAS;VIA LIBERTA 7;Petralia Sottana;Palermo;Odontoiatria;Sede Operativa
PA;AMBULATORIO ODONTOIATRICO DOTTSSA PATRIZIA MOTISI;P.ZZA CASTELNUOVO 26;Palermo;Palermo;Odontoiatria;Sede Operativa
PA;AMBULATORIO ODONTOIATRICO DR PINO ARMENIO;VIA SANT'ANNA 68;Carini;Palermo;Odontoiatria;Sede Operativa
PA;AMBULATORIO ODONTOIATRICO DR VINCENZO DI VITA & C SAS;CORSO UMBERTO 286;Cinisi;Palermo;Odontoiatria;Sede Operativa
PA;AMBULATORIO ORL DEL DOTT GIUSEPPE BORSELLINO SAS;VIA RESUTTANA 352 B;Palermo;Palermo;Otorinolaringoiatria;Sede Operativa
PA;AMICA DENTAL SRL AMBULATORIO ODONTOIATRICO;VIA D. TRENTACOSTE 56;Palermo;Palermo;Odontoiatria;Sede Operativa
PA;ANALISI BIOLOGICHE E RADIOIMMOLOGICHE DOTT C VENZA SRL ;P.ZZA SANTOCANALE 4;Cinisi;Palermo;Medicina di laboratorio;Sede Operativa
PA;ANALISI BIOLOGICHE E RADIOIMMOLOGICHE DOTT C VENZA SRL ;VIA CRISTOFORO COLOMBO 46/48;Balestrate;Palermo;Medicina di laboratorio;Punto Prelievo
PA;ANALISI BIOLOGICHE E RADIOIMMUNOLOGICHE DOTT C VENZA SRL;VIA ARCHIMEDE 19/21/23;Terrasini;Palermo;Medicina di laboratorio;Sede Operativa
PA;ANALISI CLINICHE DEL DR SALEMI VINCENZO & C SAS;VIA DELL'ORSA MAGGIORE 122;Palermo;Palermo;Medicina di laboratorio;Sede Operativa
PA;ANALISI CLINICHE DOTT A PANTANO DMP SRL;VIA CAVOUR 8-8/A;Casteldaccia;Palermo;Medicina di laboratorio;Sede Operativa
PA;ANGIOMEDICA SRL;VIA RUGGERO SETTIMO 55;Palermo;Palermo;Cardiologia;Sede Operativa
PA;ANTOFIN SRL FLORIO;VIA V. ERRANTE 54 sede operativa e sede legal;Palermo;Palermo;Comunit Terapeutica Assistita;Sede Operativa
PA;ARA ASSOCIAZIONE RIABILITAZIONE ASSISTENZA;CORSO CALATAFIMI 896/E;Palermo;Palermo;Presidi di riabilitazione funzionale di portatori disabilit fisiche psichiche e sensoriali;Sede Operativa
PA;ARCHIMED SRL;S.S.113 KM 282.400;Carini;Palermo;Dialisi;Sede Operativa
PA;ARESS FABIOLA ONLUS;VIA MOLA SNC;Termini Imerese;Palermo;Presidi di riabilitazione funzionale di portatori disabilit fisiche psichiche e sensoriali;Sede Operativa
PA;ARTIFICIAL KIDNEY CENTER SRL;VIA leonardo da vinci 305/307/309;Palermo;Palermo;Dialisi;Sede Operativa
PA;ASS LEGA DEL FILO D'ORO ONLUS;VIA S. CIMINO;Termini Imerese;Palermo;Presidi di riabilitazione funzionale di portatori disabilit fisiche psichiche e sensoriali;Sede Operativa
PA;ASS SUOR ROSINA LA GRUA;C.DA VINZERIA SN;Castelbuono;Palermo;Presidi di riabilitazione funzionale di portatori disabilit fisiche psichiche e sensoriali;Sede Operativa
PA;ASSOCIAZIONE BUON PASTORE ONLUS;VIA RISERVA REALE 7;Palermo;Palermo;Residenza Sanitaria Assistita;Sede Operativa
PA;ASSOCIAZIONE CASA DEI GIOVANI;VIA LIBERTA' 155/A;Palermo;Palermo;Strutture riabilitazione ed educative assistenziali per dipendenti sostanze d'abuso;Sede Operativa
PA;ASSOCIAZIONE CASA DEI GIOVANI;VIA RANTERIA 20;Bagheria;Palermo;Strutture riabilitazione ed educative assistenziali per dipendenti sostanze d'abuso;Sede Operativa
PA;ASSOCIAZIONE CASA DEI GIOVANI;VIA MATTARELLA 55;Bagheria;Palermo;Strutture riabilitazione ed educative assistenziali per dipendenti sostanze d'abuso;Sede Operativa
PA;ASSOCIAZIONE GENITORI SOGGETTI AUTISTICI SOLIDALI AGSAS ONLUS;VIA DON ORIONE 18/A;Palermo;Palermo;Centro diurno per soggetti affetti da disturbo autistico;Sede Operativa
PA;ASSOCIAZIONE PADRE PIO ONLUS;VIA MONTEPELLEGRINO 163;Palermo;Palermo;Presidi di riabilitazione funzionale di portatori disabilit fisiche psichiche e sensoriali;Sede Operativa
PA;ASSOCIAZIONE PRIMAVERA ONLUS;VIA A. BORRELLI 4;Palermo;Palermo;Presidi di riabilitazione funzionale di portatori disabilit fisiche psichiche e sensoriali;Sede Operativa
PA;ATM SRL;VIA BAGNERA 14;Bagheria;Palermo;Radioterapia;Sede Operativa
PA;BATTAGLINO MARIA GRAZIA & C SAS;VIA DUCA DEGLI ABRUZZI 32/34;Lercara Friddi;Palermo;Medicina di laboratorio;Sede Operativa
PA;BETA SRL;VIA G. RENI 10-14-16;Partinico;Palermo;Radiologia;Sede Operativa
PA;BIOANALISI CENTER DI MAZZARA MICHELE E SCHILLACI ADRIANA SNC;VIA TRINACRIA 28;Palermo;Palermo;Medicina di laboratorio;Sede Operativa
PA;BIODENT SRL;VIA G. PUCCINI 70;Palermo;Palermo;Odontoiatria;Sede Operativa
PA;BIODIAGNOSTICA DI A LIBERATORE & C SAS;VIA MARIO VACCARO 4;Palermo;Palermo;Medicina di laboratorio;Sede Operativa
PA;BIODIAGNOSTICA LP DEL DOTT G D LAURENZANO SAS;VIA R. LORIA 70;Palermo;Palermo;Medicina di laboratorio;Sede Operativa
PA;BRONZINO DR VINCENZO - AMBULATORIO DI CARDIOLOGIA;C.SO CALATAFIMI 977;Palermo;Palermo;Cardiologia;Sede Operativa
PA;CALDERONE & CALDERONE SNC DI PISCITELLO CONCETTA & C ;VIA ROMA 386;Palermo;Palermo;Ortopedia;Sede Operativa
PA;CAPP COOPERATIVA SOCIALE;VIA M.SE DI VILLABIANCA 120;Palermo;Palermo;Presidi di riabilitazione funzionale di portatori disabilit fisiche psichiche e sensoriali;Sede Operativa
PA;CAPPELLINO & CAPPELLINO SNC DEL DOTT CAPPELLINO GAETANO & C;VIA ROMA 386;Palermo;Palermo;Radiologia;Sede Operativa
PA;CARDIOLAB SRL;VIA AMMIRAGLIO RIZZO 72/A;Palermo;Palermo;Cardiologia;Sede Operativa
PA;CASA DI CURA MARIA ELEONORA HOSPITAL;VIALE REGIONE SICILIANA 1571;Palermo;Palermo;Casa di cura;Sede Operativa
PA;CASA DI CURA SERENA ;V.LE REGIONE SICILIANA 1470;Palermo;Palermo;Attivit ambulatoriale case di cura private;Sede Operativa
PA;CASA DI CURA SERENA ;V.LE REGIONE SICILIANA 1470;Palermo;Palermo;Casa di cura;Sede Operativa
PA;CASA DI CURA CANDELA ;Via Villareale 54;Palermo;Palermo;Attivit ambulatoriale case di cura private;Sede Operativa
PA;CASA DI CURA CANDELA ;VIA VILLAREALE 54 ;Palermo;Palermo;Casa di cura;Sede Operativa
PA;CASA DI CURA CANDELA ;VIA VILLAREALE 54 ;Palermo;Palermo;Procreazione Medicalmente Assistita;Sede Operativa
PA;CASA DI CURA IGEA ;VIA ROMA 195;Partinico;Palermo;Attivit ambulatoriale case di cura private;Sede Operativa
PA;CASA DI CURA IGEA ;VIA ROMA 195;Partinico;Palermo;Casa di cura;Sede Operativa
PA;CASA DI CURA LA MADDALENA;VIA S.LORENZO COLLI 312/D;Palermo;Palermo;Attivit ambulatoriale case di cura private;Sede Operativa
PA;CASA DI CURA LA MADDALENA;VIA S.LORENZO COLLI 312/D;Palermo;Palermo;Casa di cura;Sede Operativa
PA;CASA DI CURA LATTERI;VIA CORDOVA 64;Palermo;Palermo;Casa di cura;Sede Operativa
PA;CASA DI CURA MACCHIARELLA ;V.LE REGINA MARGHERITA 25;Palermo;Palermo;Attivit ambulatoriale case di cura private;Sede Operativa
PA;CASA DI CURA MACCHIARELLA ;VIALE REGINA MARGHERITA 25;Palermo;Palermo;Casa di cura;Sede Operativa
PA;CASA DI CURA NOTO PASQUALINO ;VIA DANTE 330;Palermo;Palermo;Casa di cura;Sede Operativa
PA;CASA DI CURA TORINA ;VIA SPALLITTA 8;Palermo;Palermo;Attivit ambulatoriale case di cura private;Sede Operativa
PA;CASA DI CURA TORINA ;VIA SPALLITTA 18;Palermo;Palermo;Casa di cura;Sede Operativa
PA;CASA DI CURA TRIOLO-ZANCLA;P.ZZA FONDERIA 23;Palermo;Palermo;Attivit ambulatoriale case di cura private;Sede Operativa
PA;CASA DI CURA TRIOLO-ZANCLA;PIAZZA FONDERIA 23;Palermo;Palermo;Casa di cura;Sede Operativa
PA;CASA DI CURA VILLA MARGHERITA ;VIA M.SE DI VILLABIANCA 6;Palermo;Palermo;Attivit ambulatoriale case di cura private;Sede Operativa
PA;CASA DI CURA VILLA MARGHERITA ;VIA M.SE DI VILLABIANCA 6;Palermo;Palermo;Casa di cura;Sede Operativa
PA;CASA DI CURA VLLA SERENA ;VIALE REGIONE SICILIANA 1470;Palermo;Palermo;Radiologia;Sede Operativa
PA;CASA DI CURE ORESTANO ;VIA D'ASARO 48;Palermo;Palermo;Attivit ambulatoriale case di cura private;Sede Operativa
PA;CASA DI CURE ORESTANO ;VIA D'ASARO 48;Palermo;Palermo;Casa di cura;Sede Operativa
PA;CASA FAMIGLIA ROSETTA ONLUS - PG PUGLISI ;VIA LIBERTA' 46;Partinico;Palermo;Casa Alloggio per Malati di Aids;Sede Operativa
PA;CENTRO ANALISI CLINICHE BATTERIOLOGICHE IMMUNOLOGICHE - RADIOIMMUNOLOGICHE VALENTINO SRL;P.ZZA GIULIO CESARE 44;Palermo;Palermo;Medicina di laboratorio;Sede Operativa
PA;CENTRO ANALISI CLINICHE DEI DOTTRI G M GIORDANO E S SANTINO SNC;SALITA S. CRISTOFORO 9;Monreale;Palermo;Medicina di laboratorio;Sede Operativa
PA;CENTRO ANALISI CLINICHE DI LA LIA G & C SAS;VIA TRAINA 18;Misilmeri;Palermo;Medicina di laboratorio;Sede Operativa
PA;CENTRO ANALISI CLINICHE DOTTSSA BUTERA DOROTEA MARIA E C SNC;VIA DANTE PROLUNGAMENTO N.115;Bagheria;Palermo;Medicina di laboratorio;Sede Operativa
PA;CENTRO ANALISI CLINICHE MADONIE SCARL;VIA GRAMSCI N. 39-43 ;Palermo;Palermo;Medicina di laboratorio - Aggregazione;Sede Operativa
PA;CENTRO ANALISI CLINICHE MADONIE SCARL;via Gramsci 39;;Palermo;Medicina di laboratorio - Aggregazione;Punto di accesso
PA;CENTRO ANALISI CLINICHE MADONIE SCARL;via Principe Umberto 5/bis;Castelbuono;Palermo;Medicina di laboratorio - Aggregazione;Punto di accesso
PA;CENTRO ANALISI CLINICHE S ROSALIA DELLA DOTTSSA MAIORANA GIUSEPPA & C SNC;VIA MONTEGRAPPA 118;Palermo;Palermo;Medicina di laboratorio;Sede Operativa
PA;CENTRO ANALISI CLINICHE SNC DI MENDOLA GAETANO GIUSEPPE & MILLONZI ANGELO SNC;VIA DE GASPERI 3;Campofelice di Roccella;Palermo;Medicina di laboratorio;Sede Operativa
PA;CENTRO ANALISI CLINICHE VALLEDOLMO;VIA CADORNA 54;Valledolmo;Palermo;Medicina di laboratorio;Sede Operativa
PA;CENTRO ANALISI E DIAGNOSTICA CLINICA SRL;VIA ORETO NUOVA 440/A;Palermo;Palermo;Medicina di laboratorio;Sede Operativa
PA;CENTRO ANDROS ;VIA AUSONIA 43/45;Palermo;Palermo;Procreazione Medicalmente Assistita;Sede Operativa
PA;CENTRO BIOMEDICO SCARL;VIA DE GASPERI 53/67;Palermo;Palermo;Endocrinologia;Sede Operativa
PA;CENTRO BIOMEDICO SCARL;via De Gasperi 53;Palermo;Palermo;Medicina di laboratorio - Aggregazione;Punto di accesso
PA;CENTRO BIOMEDICO SCARL;via Piave 36;Altavilla Milicia;Palermo;Medicina di laboratorio - Aggregazione;Punto di accesso
PA;CENTRO BIOMEDICO SCARL;via della Regione 3;Partinico;Palermo;Medicina di laboratorio - Aggregazione;Punto di accesso
PA;CENTRO BIOMEDICO SCARL;corso Umberto I 23;Prizzi;Palermo;Medicina di laboratorio - Aggregazione;Punto di accesso
PA;CENTRO BIOMEDICO SCARL;piazza S. Elia 16;Caccamo;Palermo;Medicina di laboratorio - Aggregazione;Punto di accesso
PA;CENTRO BIOMEDICO SCARL ;VIA ALCIDE DE GASPERI 53/67;Palermo;Palermo;Dermatologia;Sede Operativa
PA;CENTRO BIOMEDICO SCARL ;VIA A. DE GASPERI N. 53/67;Palermo;Palermo;Medicina di laboratorio - Aggregazione;Sede Operativa
PA;CENTRO CLINICO DERMO-COSMETOLOGICO SAS DI COSTA ANTONINA;VIA DOMENICO COSTANTINO 17;Palermo;Palermo;Dermatologia;Sede Operativa
PA;CENTRO CLINICO DIAGNOSTICO SAN MARTINO SRL;P.ZZA PIETRO MICCA N. 6;Palermo;Palermo;Medicina di laboratorio;Sede Operativa
PA;CENTRO DERMATOLOGICO LISTRO SRL ;VIA MAMMANA 88;Palermo;Palermo;Dermatologia;Sede Operativa
PA;CENTRO DI BIOLOGIA DELLA RIPRODUZIONE ;VIA VILLAREALE 54 ;Palermo;Palermo;Procreazione Medicalmente Assistita;Sede Operativa
PA;CENTRO DI FISIOKINESITERAPIA AVANZATA SRL;CORSO UMBERTO E MARGHERITA N 16;Termini Imerese;Palermo;Presidio ambulatoriali recupero riabilitazione;Sede Operativa
PA;CENTRO DI FISIOKINESITERAPIA EMMOLA SRL;P.ZZA P.PE CAMPOREALE 27;Palermo;Palermo;Presidio ambulatoriali recupero riabilitazione;Sede Operativa
PA;CENTRO DI FISIOTERAPIA SPAZIO VITALE SRL;VIA PROVINCIALE 46 PIOPPO;Monreale;Palermo;Presidi di riabilitazione funzionale di portatori disabilit fisiche psichiche e sensoriali;Sede Operativa
PA;CENTRO DI MEDICINA NUCLEARE S GAETANO SRL;SS 113 KM 246;Bagheria;Palermo;Medicina nucleare;Sede Operativa
PA;CENTRO DI MEDICINA NUCLEARE S.R.L.;VIA AGRIGENTO 5;Palermo;Palermo;Medicina nucleare;Sede Operativa
PA;CENTRO DI NEFROLOGIA E DIALISI SRL;VIA INGEGNEROS 106;Palermo;Palermo;Dialisi;Sede Operativa
PA;CENTRO DI RADIODIAGNOSTICA SRL;VIA CUSMANO 10;Palermo;Palermo;Radiologia;Sede Operativa
PA;CENTRO DI RADIOLOGIA MEDICA SRL;Via Tommaso Marcellini 61/A;Palermo;Palermo;Radiologia;Sede Operativa
PA;CENTRO DI RADIOLOGIA SRL;VIA B. MATTARELLA 30;Bagheria;Palermo;Radiologia;Sede Operativa
PA;CENTRO DIACONALE LA NOCE ISTITUTO VALDESE;VIA G. E. DI BLASI 12;Palermo;Palermo;Presidi di riabilitazione funzionale di portatori disabilit fisiche psichiche e sensoriali;Sede Operativa
PA;CENTRO DIAGNOSTICA PER IMMAGINI SRL;C.SO ITALIA 158/160;Carini;Palermo;Radiologia;Sede Operativa
PA;CENTRO DIAGNOSTICO - ASSOCIAZIONE TRA PROFESSIONISTI;PIAZZA S.FRANCESCO ;Ficarazzi;Palermo;Medicina di laboratorio;Sede Operativa
PA;CENTRO DIAGNOSTICO ANALISI CLINICHE DI STABILE ROCCO & C SAS;C.SO BUTERA 571;Bagheria;Palermo;Medicina di laboratorio;Sede Operativa
PA;CENTRO DIAGNOSTICO CLINICO EMATOLOGICO SPEM DI FIASCONARO CONCETTA & C SNC;VIA VITT. EMANUELE 91;Castelbuono;Palermo;Medicina di laboratorio;Sede Operativa
PA;CENTRO EMODIALITICO MERIDIONALE SRL;VIA GEN. CANTORE 21;Palermo;Palermo;Dialisi;Sede Operativa
PA;CENTRO EUROPA DI GOTTARDO AMEDEO & C SNC;V.LE EUROPA 62/A;Villabate;Palermo;Presidio ambulatoriali recupero riabilitazione;Sede Operativa
PA;CENTRO FISIOKINESITERAPICO SAS DEL DOTT MALTESE;VIA VENUTI 302;Cinisi;Palermo;Presidio ambulatoriali recupero riabilitazione;Sede Operativa
PA;CENTRO FISIOTERAPICO DI BENEDETTO CUCCIO SRL ;VIA RUGGERO MARTURANO 26;Palermo;Palermo;Presidio ambulatoriali recupero riabilitazione;Sede Operativa
PA;CENTRO FISIOTERAPICO MUSARRA SRL;VIA NAZIONALE 397;Carini;Palermo;Presidio ambulatoriali recupero riabilitazione;Sede Operativa
PA;CENTRO LING DI RIEDUCAZIONE NEUROMOTORIA E DI FISIOTERAPIA SRL;VIA INGEGNEROS 58;Palermo;Palermo;Presidio ambulatoriali recupero riabilitazione;Sede Operativa
PA;CENTRO MEDICO DI FISIOKINESI TERAPIA E SPORT (BODY CLUB) DI GILIA GIULIO SAS;VIA V. GUASTELLA 14;Misilmeri;Palermo;Presidio ambulatoriali recupero riabilitazione;Sede Operativa
PA;CENTRO MEDICO DI ORTOPEDIA E FISIOKINESITERAPIA SRL;VIA PASCAL 11;Partinico;Palermo;Presidio ambulatoriali recupero riabilitazione;Sede Operativa
PA;CENTRO MEDICO DIAGNOSTICO TERAPEUTICO SRL;CORSO UMBERTO E MARGHERITA 13/15;Termini Imerese;Palermo;Radiologia;Sede Operativa
PA;CENTRO MEDICO IPPOCRATE SNC DI MICELI ELISABETTA & C;VIA P. NOVELLI 18;Monreale;Palermo;Odontoiatria;Sede Operativa
PA;CENTRO MEDICO MANTIA SRL;VIA DE SPUCHES 22;Palermo;Palermo;Presidio ambulatoriali recupero riabilitazione;Sede Operativa
PA;CENTRO MEDICO NEFROLOGICO SRL;VIA DEL PROGRESSO 2 ;Termini Imerese;Palermo;Dialisi;Sede Operativa
PA;CENTRO MEDICO NEFROLOGICO SRL;VIA C.A. DALLA CHIESA SNC - C.DA S.ANNA;Lercara Friddi;Palermo;Dialisi;Sede Operativa
PA;CENTRO MEDICO ODONTOIATRICO DOTT LENZITTI FEDERICO & C SAS;VIA DAMMUSO 151;Palermo;Palermo;Odontoiatria;Sede Operativa
PA;CENTRO MEDICO ODONTOIATRICO ORLANDO DI ORLANDO SEBASTIANO E C SAS;VIA XVI MARZO 1;Monreale;Palermo;Odontoiatria;Sede Operativa
PA;CENTRO MEDICO SOCRATES SRL;VIA DELLA SPIGA 15/17;Marineo;Palermo;Presidio ambulatoriali recupero riabilitazione;Sede Operativa
PA;CENTRO MINERVA ANALISI CLINICHE SRL;LARGO CEFALU' 8;Palermo;Palermo;Medicina di laboratorio;Sede Operativa
PA;CENTRO OCULISTICO LA MANTIA DOTT LA MANTIA & C SAS ;PIAZZA PRINCIPE DI CAMPOREALE 26/D;Palermo;Palermo;Oculistica;Sede Operativa
PA;CENTRO OCULISTICO DOMUS SRL;VIA SCIUTI 102/F;Palermo;Palermo;Oculistica e chirurgia ambulatoriale;Sede Operativa
PA;CENTRO OCULISTICO EUCLIDE SAS DI MONTALTO FRANCESCO PAOLO E C;VIA CICERONE 28;Bagheria;Palermo;Oculistica e chirurgia ambulatoriale;Sede Operativa
PA;CENTRO OCULISTICO LO BIANCO SAS DI GIOVANNI LO BIANCO;VIA L. STURZO 8;Termini Imerese;Palermo;Oculistica e chirurgia ambulatoriale;Sede Operativa
PA;CENTRO OCULISTICO MOAVERO DI MARCELLO MOAVERO & C SAS;VIA DUCA DELLA VERDURA 4;Palermo;Palermo;Oculistica;Sede Operativa
PA;CENTRO ODONTOIATRICO BISCONTI DI LEONARDO DELLA DOTT.SSA FEDERICA DI LEONARDO SAS;VIA CATALDO PARISIO 95;Palermo;Palermo;Odontoiatria;Sede Operativa
PA;CENTRO ODONTOIATRICO DEL DOTT GAGLIO FRANCESCO & C SAS;VIA BENEVENTO 10;Partinico;Palermo;Odontoiatria;Sede Operativa
PA;CENTRO ODONTOIATRICO DEL DOTT GIACOMO RAPPA & C SAS;VIA PASCAL 3;Partinico;Palermo;Odontoiatria;Sede Operativa
PA;CENTRO ODONTOIATRICO DEL DOTT GIROLAMO TURANO CAMPELLO SAS;VIA P. SCAGLIONE 87;Palermo;Palermo;Odontoiatria;Sede Operativa
PA;CENTRO ODONTOIATRICO DEL DOTT MAURIZIO FULVIO PURPURA & C SAS;V.LE DELLE ALPI 16;Palermo;Palermo;Odontoiatria;Sede Operativa
PA;CENTRO ODONTOIATRICO DEL DOTT RAPPA GIACOMO E C SAS;VIA F. RICCOBONO 40;Montelepre;Palermo;Odontoiatria;Sede Operativa
PA;CENTRO ODONTOIATRICO DEL DOTT VINCENZO TAMBURELLO & C SNC;CORSO CALATAFIMI 631;Palermo;Palermo;Odontoiatria;Sede Operativa
PA;CENTRO ODONTOIATRICO DEL DR ROMANO VITO SAS;P.ZZA CASTELNUOVO 26/A;Palermo;Palermo;Odontoiatria;Sede Operativa
PA;CENTRO ODONTOIATRICO DELLA DOTTSSA MARIA MADDALENA LUCIDO SNC;VIA GIULIO CESARE 44;Villabate;Palermo;Odontoiatria;Sede Operativa
PA;CENTRO ODONTOIATRICO DELLA DSSA GRAZIA CONCETTA STIMOLO SAS;VIA TASCA LANZA 26;Palermo;Palermo;Odontoiatria;Sede Operativa
PA;CENTRO ODONTOIATRICO DI ANSELMO SALVATORE SAS;VIA RESUTTANA 352;Palermo;Palermo;Odontoiatria;Sede Operativa
PA;CENTRO ODONTOIATRICO DI FAZIO SAS DEL DOTT DI FAZIO FILIPPO & C;VIA VENERO 120;Monreale;Palermo;Odontoiatria;Sede Operativa
PA;CENTRO ODONTOIATRICO DI FOLLARI SAS DI UMBERTO FOLLARI;VIA GORIZIA 22;Palermo;Palermo;Odontoiatria;Sede Operativa
PA;CENTRO ODONTOIATRICO DI GRECO SAS EL DR GIACOMO BRUNO GRECO & C;VIA MATTEOTTI 40;Piana degli Albanesi;Palermo;Odontoiatria;Sede Operativa
PA;CENTRO ODONTOIATRICO DI LEO SAS DI GIUSEPPE DI LEO;VIA VENTURA 1;Palermo;Palermo;Odontoiatria;Sede Operativa
PA;CENTRO ODONTOIATRICO DOTT BRANCATO SALVATORE SNC;P.ZZA MATTARELLA 13;Ciminna;Palermo;Odontoiatria;Sede Operativa
PA;CENTRO ODONTOIATRICO DOTT NICOLO' MALTESE E C SNC;VIA LA MARMORA 75;Palermo;Palermo;Odontoiatria;Sede Operativa
PA;CENTRO ODONTOIATRICO DOTT S LA TORRE SNC;C.SO CAMILLO FINOCCHIARO APRILE 124;Palermo;Palermo;Odontoiatria;Sede Operativa
PA;CENTRO ODONTOIATRICO GRIFFO SAS DELLA DOTTSSA MARCELLA GRIFFO & C;VIA GIUSEPPE ALESSI 44 ;Palermo;Palermo;Odontoiatria;Sede Operativa
PA;CENTRO ODONTOIATRICO JUST SMILE SAS DEL DOTT TINERVIA GIUSEPPE;VIA A. DE GASPERI 41;Torretta;Palermo;Odontoiatria;Sede Operativa
PA;CENTRO ODONTOIATRICO POLIVALENTE SNC DI MICELI BENEDETTO;VIA ALEARDO ALEARDI 18;Palermo;Palermo;Odontoiatria;Sede Operativa
PA;CENTRO ODONTOIATRICO SACCONE SAS DELLA DRSSA SACCONE ROBERTA & C;VIA PAOLO ORSI 3;Palermo;Palermo;Odontoiatria;Sede Operativa
PA;CENTRO ODONTOIATRICO SAS DI SCORSONE DANIELE & C;VIA GENERALE DALLA CHIESA 15;Palermo;Palermo;Odontoiatria;Sede Operativa
PA;CENTRO ODONTOIATRICO SCAFFIDI DELLA DOTTORESSA SCAFFIDI ABBATE LOREDANA SAS;VIA G. PREZZOLINI 45 (GIA VIA NUOVA 71);Palermo;Palermo;Odontoiatria;Sede Operativa
PA;CENTRO ODONTOIATRICO SICILIANO COS DI DE CASTRO LUCIA & C SNC ;VIA GEN D.CHINNICI 34;Palermo;Palermo;Odontoiatria;Sede Operativa
PA;CENTRO ODONTOIATRICO SICILIANO SRL;VIA MARCHE 16 ;Palermo;Palermo;Odontoiatria;Sede Operativa
PA;CENTRO ODONTOIATRICO SPATAFORA SAS DI SPATAFORA M TERESA;VIA ORETO 305;Palermo;Palermo;Odontoiatria;Sede Operativa
PA;CENTRO ODONTOIATRICO TERESI SAS DI TERESI G;VIA SPERONE 6 ;Palermo;Palermo;Odontoiatria;Sede Operativa
PA;CENTRO ORTOPEDICO FISIOTERAPICO SRL;VIA COSMA E DAMIANO 11;Partinico;Palermo;Presidio ambulatoriali recupero riabilitazione;Sede Operativa
PA;CENTRO PROCREAZIONI ASSISTITE DEMETRA ;VIA A. PACINOTTI 34;Palermo;Palermo;Procreazione Medicalmente Assistita;Sede Operativa
PA;CENTRO PSICOFISICO E DI FKT SRL;VIA P.PE DI VILLAFRANCA 50/B;Palermo;Palermo;Presidio ambulatoriali recupero riabilitazione;Sede Operativa
PA;CENTRO RADIOLOGICO DEL DOTT ANTONINO POLIZZI SRL;VIA MACHIAVELLI 41;Misilmeri;Palermo;Radiologia;Sede Operativa
PA;CENTRO RADIOLOGICO DEL DOTT LEONARDO SANZONE & C SAS;VIA V.EMANUELE 18;Partinico;Palermo;Radiologia;Sede Operativa
PA;CENTRO SERVIZI SANITARI ITALIANI DI SIRAGUSA N GIUSEPPE SRL;VIA SANTA LUCIA 35;Corleone;Palermo;Dialisi;Sede Operativa
PA;CENTRO SICILIANO DI NEFROLOGIA E DIALISI SRL;VIA VITALIANO BRANCATI SN;;Palermo;Dialisi;Sede Operativa
PA;CEOPAR ONLUS;VIA AUSONIA 39;Palermo;Palermo;Presidi di riabilitazione funzionale di portatori disabilit fisiche psichiche e sensoriali;Sede Operativa
PA;CFC CENTRO FISIOTERAPICO DEL CORLEONESE SRL;VIA DON G. COLLETTO 17;Corleone;Palermo;Poliambulatorio;Sede Operativa
PA;CHECK UP SRL;VIA PARISI 40;Palermo;Palermo;Medicina di laboratorio;Sede Operativa
PA;CLERALAB SCARL;corso Italia 110;Carini;Palermo;Medicina di laboratorio - Aggregazione;Punto di accesso
PA;CLINICA DENTALE DEL DR ERASMO ENIA & C SAS;VIA ZANGARA 1;Partinico;Palermo;Odontoiatria;Sede Operativa
PA;CLINICAL COURSE SRL AMBULATORIO DI NEUROLOGIA;VIA DE GASPERI 81;Palermo;Palermo;Neurologia;Sede Operativa
PA;CLINICAL COURSE SRL LABORATORIO ANALISI CLINICHE MICROBIOLOGICHE;VIA PASCOLI 1;Villabate;Palermo;Medicina di laboratorio;Sede Operativa
